date,employee_title,location,employee_status,review_title,years_at_company,helpful,pros,cons,advice_to_mgmt,rating_overall,rating_balance,rating_culture,rating_career,rating_comp,rating_mgmt
Wed Aug 21 2019 12:42:08 GMT-0700 (Pacific Daylight Time), Human Resources Manager,"San Diego, CA",Current Employee ,"Team Focused, High Speed Culture",I have been working at Intuit full-time for more than 3 years,," Top workplace in San Diego (Campus, Pay, Benefits, Culture)
- Smartest Co-Workers I Have Worked With 
- Win Together Environment
- High Speed, Big Wins Culture (dependent on Business Bet)"," Lots of Turnover Lately in Upper Management (Talent, HR)
- Divisional Leadership Sometimes Disconnected From Day-To-Day Work of Front Line Team (Informed vs Leading the Work)"," Understanding Your Front Line Team (Specifically Those Supporting A Big Bet) Is Highly Important. As We Grow, I Have Noticed That Leaders (VP and Above) Seem To Be More and More Disconnected From The Work It Takes To Make The Vision and Plan a Reality.",5.0,4.0,5.0,5.0,5.0,4.0
Wed Sep 04 2019 07:04:22 GMT-0700 (Pacific Daylight Time), QBK Expert,"Charlotte, NC",Current Employee ,90 day employment,I have been working at Intuit part-time for less than a year,,Best support for employees and for increasing ones knowledge. The team concept is one of the best.,Remote work does not allow for physical interaction. No logo shirts for QBL,,4.0,5.0,4.0,4.0,4.0,4.0
Mon Aug 19 2019 18:08:18 GMT-0700 (Pacific Daylight Time), Senior Recruiter,,Current Employee ,Values Driven Technology Company,I have been working at Intuit full-time,,"Great culture, customer obsessed company making transition to services",Can be faster at decision making,,5.0,5.0,5.0,5.0,4.0,4.0
Mon Aug 19 2019 19:50:42 GMT-0700 (Pacific Daylight Time), Group Marketing Manager,,Current Employee ,Innovative Values Driven Company,I have been working at Intuit full-time for more than 8 years,,"We do meaningful work, putting money back in people's pockets and that is very rewarding. Everyone is expected to innovate, and we put the customer first. We don't just use technology for the sake of working with cool technology. We want to solve challenging financial problems using technology that will make a real difference in the world.",Big company problems. Lots of meetings. But this breeds strong collaboration.,,5.0,5.0,5.0,5.0,5.0,5.0
Tue Aug 20 2019 06:42:37 GMT-0700 (Pacific Daylight Time), Recruiter,,Current Employee ,Amazing Culture!,I have been working at Intuit full-time for more than a year,,"Great culture, benefits are some of the best I've seen, supportive management, collaborative culture, and win together environment.",I have no cons to share.,,5.0,4.0,5.0,5.0,5.0,5.0
Tue Aug 20 2019 06:47:52 GMT-0700 (Pacific Daylight Time), Corporate Recruiter,"Plano, TX",Current Employee ,Enriching place to work!,I have been working at Intuit full-time for more than 3 years,,"I have personally experience a flexibility and a great work life balance! 
The benefits are comprehensive with lots of perks and the company continues to benchmark and look for ways to improve.
I am inspired by our leaders and appreciate their integrity.
I love the strong culture of diversity and inclusion. I find that it is a fun place to work with many different thought partners and perspectives. It's freeing to be able to bring your whole self to work.
If you want to take advantage, you can develop and grow, there is plenty of opportunity for innovation and stretching yourself. 
I love coming into the office every day, lots of tasty snacks and fruit in the break rooms for free, a fancy coffee machines for delicious cup of coffee whenever I need a jolt, and the cafe is really good. My favorite thing to take advantage of is our Eat Right for Life, it only costs $3.24 with tax!","Change is a constant, need to be adaptable.",,5.0,5.0,5.0,4.0,5.0,5.0
Tue Aug 20 2019 08:52:16 GMT-0700 (Pacific Daylight Time), Talent Acquisition,"Mountain View, CA",Current Employee ,Best Place I have ever Worked,I have been working at Intuit full-time for more than a year,,"Intuit really cares about its employees. I have never worked in a company with such great benefits. We get $1000 a year toward health and wellness, other health incentives such as being Tobacco free and using a fit bit get you more $$'s to use. My health insurance premiums are the lowest I have ever had. We don't have free meals but food is provided at many meetings and we have an extensive snack room. Plus - our cafeteria's are partially subsidized. Intuit lives and breathes its core values. It is not just writing on a wall.","Just like any tech company, there is a lot of turn over. Though I honestly don't know what people think they are going to get by going elsewhere. I have worked at several Fortune 100 companies in my 20+ years of recruiting and Intuit is truly the best.",The one benefit I wish you would consider is a sabbatical. Glad to see you upped our vacation accrual but the sabbatical would be really great.,5.0,5.0,5.0,5.0,5.0,5.0
Tue Sep 03 2019 07:29:48 GMT-0700 (Pacific Daylight Time), Customer Success Manager,,Current Employee ,Great benefits,I have been working at Intuit full-time for more than 5 years,,"Benefits are amazing, cafe on site. Lots of perks.",Not a ton of room for growth,,4.0,,,,,
Tue Sep 03 2019 11:36:36 GMT-0700 (Pacific Daylight Time), Senior Software Engineer,"Boise, ID",Current Employee ,Great place to work,I have been working at Intuit full-time for more than a year,,"Work-life balance is good
Good benefits
The office culture","Siloed teams, cross communication between teams could be improved",,4.0,4.0,5.0,5.0,4.0,4.0
Mon Aug 19 2019 16:31:37 GMT-0700 (Pacific Daylight Time), Consultant,"San Diego, CA",Current Employee ,Best Place To Work!,I have been working at Intuit full-time,,"They live and stand by their values, excellent benefits, great work/life balance, and an opportunity to work with and learn from industry leaders.","I love coming to work everyday and don't have any cons to offer at this time. Parking is easy, no bad traffic coming and going, this location is beautiful.",,5.0,5.0,5.0,5.0,5.0,5.0
Mon Aug 19 2019 16:35:11 GMT-0700 (Pacific Daylight Time), Recruiter,"San Diego, CA",Current Employee ,Working at Intuit,I have been working at Intuit full-time for more than a year,,"Most Amazing company I've ever worked for. We hire the best of the best, Great benefits, Beautiful campus. I'm extremely proud to work at Intuit",No Cons so far,,5.0,5.0,5.0,5.0,5.0,5.0
Mon Aug 19 2019 16:36:42 GMT-0700 (Pacific Daylight Time), Senior Program Manager,"Mountain View, CA",Current Employee ,People Driven Culture,I have been working at Intuit full-time for more than 3 years,,Company is committed to putting people first. I have never been part of a work culture that cares about its people as much as Intuit does. This cascades to a productive and happy working environment of people who care about each other.,"Obviously the work culture is very dependent team to team, so being able to identify toxic managers quicker and listen to employee feedback.",,5.0,5.0,5.0,5.0,5.0,5.0
Mon Sep 02 2019 14:36:28 GMT-0700 (Pacific Daylight Time), Customer Service Agent,"Buck Mobil Home Park, NC",Former Employee ,Great Company,I worked at Intuit full-time for more than a year,,Flexible Schedule can have some weekends off.,A great deal of pressure,,4.0,,,,,
Mon Sep 02 2019 14:45:28 GMT-0700 (Pacific Daylight Time), Principal,,Former Employee ,Nice place to work,I worked at Intuit full-time,,Good work life balance in the firm,Not too focused on promotions,,3.0,3.0,3.0,2.0,3.0,3.0
Wed Aug 14 2019 09:51:55 GMT-0700 (Pacific Daylight Time), Senior Site Reliability Engineer,"San Diego, CA",Current Employee ,Goof company to work for,I have been working at Intuit full-time for more than 5 years,1,"Benefits such as 401k, stock options, maternity/paternity leaves, ESSP,etc",Team & company Culture is changing at Intuit big time,,5.0,4.0,4.0,4.0,4.0,3.0
Fri Aug 16 2019 11:54:34 GMT-0700 (Pacific Daylight Time), Group Marketing Manager,,Current Employee ,Great place to work - truly walk the talk,I have been working at Intuit full-time for more than a year,,I've been at Intuit for a little over one year. This is a company that has every employee actively gain insights on its customers. If you're interested in empowering self-employed/small business owners and want to have an impact this is the place for you. The culture and benefits are great,"As in most large companies, upward mobility is hard but there are ample opportunities to learn in new areas.",Please continue the focus on bringing in diverse talent. It enriches our workplace.,5.0,5.0,5.0,4.0,5.0,5.0
Fri Aug 16 2019 15:02:53 GMT-0700 (Pacific Daylight Time), Customer Service Representative,"Boise, ID",Current Employee ,Intuit LOVES their employees,I have been working at Intuit full-time for less than a year,,Amazing Culture- Great People-Training- Benefits & Perks are Great!,There are no con's I have found yet!,,5.0,5.0,5.0,5.0,5.0,5.0
Sun Aug 11 2019 18:41:52 GMT-0700 (Pacific Daylight Time), Product Manager,"Mountain View, CA",Current Employee ,Good job- but there's only so many ways to fill a tax form,I have been working at Intuit full-time for more than 3 years,1,Being a monopoly- great to have plenty of customers,"With Trumps' postcard tax return, he'll the only one using Turbotax- and you know he doesn't pay to use services",Time to diversify man!,5.0,5.0,5.0,5.0,5.0,5.0
Thu Aug 29 2019 14:20:47 GMT-0700 (Pacific Daylight Time), Senior Program Manager,"San Diego, CA",Current Employee ,Incredible place to work,I have been working at Intuit full-time for less than a year,,"Intuit is a positive, fun, innovative company. Senior leadership is strong, and they have a clear, inspiring vision for the company. Intuit cares about its employees, is supportive of a positive work/life balance, and provides many opportunities to try new roles, advance, and learn for anyone that is willing to work hard. Intuit also cares about the world, and gives generously to communities and people in need in a variety of ways (including an employee matching program). In general, people here are incredibly nice, smart, and capable. In addition, the salary, benefits, stock, and other employee rewards and offerings are excellent. I count myself very fortunate to be part of Intuit and would highly recommend as an excellent place to work.","Like all large companies, there can be challenges navigating layers of management and politics. However, the benefits far outweigh any cons, and Leadership is very receptive to feedback and ideas around how to continuously improve.",,4.0,5.0,5.0,5.0,5.0,4.0
Tue Aug 13 2019 07:19:21 GMT-0700 (Pacific Daylight Time), Tax Associate,"Savannah, GA",Current Employee ,Best job ever,I have been working at Intuit full-time for more than a year,,Everything is great no issues,No issues at all best company ever,,5.0,,,,,
Fri Aug 09 2019 13:31:58 GMT-0700 (Pacific Daylight Time), Crendential Tax Specialist,"Remote, OR",Former Employee ,Crendentialed Tax Specialist,I worked at Intuit full-time for more than a year,1,"Remote work
pick your schedule
split shifts",Customers can talk on and on unrelated to job and it messes with your metrics,,5.0,5.0,5.0,5.0,5.0,5.0
Mon Aug 26 2019 11:58:12 GMT-0700 (Pacific Daylight Time), Senior Marketing Manager,"Mountain View, CA",Current Employee ,"Very reputable, purpose-driven company",I have been working at Intuit full-time for less than a year,,Level of integrity across the employee base. Lack of unnecessary hierarchy. Employees encouraged to bring their whole selves. Work-life,"Brand organizations operate in siloed manner, not always as one company","Projects must have one D, and one A...when there are more than one of either, there will be issues.",4.0,5.0,5.0,4.0,5.0,5.0
Thu Aug 08 2019 15:46:41 GMT-0700 (Pacific Daylight Time), Business Operations Analyst,"Mountain View, CA",Current Employee ,Exciting Place to Work,I have been working at Intuit full-time for less than a year,,"Great benefits, some of which I never would have thought of once I joined. Amazing campus, which great amenities for its employees. The orientation was nice, nothing too long but not to short. Enough information to get you started and feeling confident day one",Traffic getting to the office in the morning and leaving is a pain but it can be mitigated if you have a HOV certified car or carpool or use other forms of transportation.,,5.0,5.0,5.0,5.0,5.0,5.0
Thu Aug 08 2019 15:50:02 GMT-0700 (Pacific Daylight Time), Software Engineer II,"Mountain View, CA",Current Employee ,Great place to work,I have been working at Intuit full-time for less than a year,," Team environment
- Team connections
- Easy to connect to anyone in hierarchy
- Benefits, lunch options
- Well being for life program
- Customer focused and working for prosperity of the world",HR connect and other question assistance related to any concern could be available at least 12 hours every day. Not a big problem.,,5.0,4.0,5.0,5.0,4.0,5.0
Thu Aug 08 2019 16:00:11 GMT-0700 (Pacific Daylight Time), Software Engineer,"Mountain View, CA",Current Employee ,Awesomeness of Intuit as a company!!!,I have been working at Intuit full-time for less than a year,,Pro-employee company. Lots of health benefits!!,"No free food, but has subsidized one, so good!!","Conduct bootcamps to explore various teams, and select accordingly. Will really help!!",5.0,5.0,5.0,4.0,5.0,5.0
Thu Aug 08 2019 16:08:12 GMT-0700 (Pacific Daylight Time), Senior Business Data Analyst,,Current Employee ,Truly one of the great places to work,I have been working at Intuit full-time for more than 10 years,,"Great work life balance, really smart people, awesome benefits, company truly cares about the employees",Things are move really quickly and can be stressful if you are new to the Intuit culture,Keep doing what you are doing and be more open to risk taking,5.0,5.0,5.0,5.0,5.0,5.0
Wed Sep 11 2019 21:25:46 GMT-0700 (Pacific Daylight Time), Director,"Mountain View, CA",Current Employee ,Lack of focus and direction,I have been working at Intuit full-time for more than 5 years,,"easy to get promoted 
good 401k and health benefits. 
Stock going up!","substandard technical leaders or Principle engineers. 
Product is very slow evolving 
Always top down 
Moving towards a central model which kills innovation",,1.0,4.0,2.0,3.0,4.0,1.0
Mon Aug 19 2019 18:06:42 GMT-0700 (Pacific Daylight Time), Program Manager,"San Jose, CA",Former Employee ,If you’re not a white male - keep moving,I worked at Intuit full-time for more than 5 years,,"Colleagues with good hearts, amazing skills and best of intentions","Corrupt leadership, trying their hardest to hide all the accusations of sexual harassment and gender discrimination - more specifically females who are underrepresented minorities. Unfair pay - regardless of employee type.",Clean house - especially in TA. But that would mean management needs to leave as well - about 80% of them.,2.0,2.0,3.0,2.0,3.0,1.0
Sun Aug 18 2019 14:49:58 GMT-0700 (Pacific Daylight Time), Staff Business Data Analyst,"San Diego, CA",Current Employee ,My experience working for Intuit,I have been working at Intuit full-time for more than 8 years,1,The benefits are good and one of the better companies in the San Diego area. Opportunities to interact with many different leaders across the company. Fast paced work and ability to learn many different aspects of the business and products.,"There is little to no direction coming from the execs, and what little direction we are given will constantly change. You are measured against an invisible moving target and expected to get on board or get out. 
If you're trying to get hired, be prepared to get ghosted by the recruiters. You will need to be persistent and make an effort to follow up with them to get updates. Do not expect them to call you.","The recruiters need to be on top of staying with incoming talent. I have seen too many exceptional candidates walk away and take other offers because the recruiting team does not call back, send emails, or even have voicemail space on their phones. It's embarrassing when people I've recommended call me to ask why they haven't heard anything and can't leave a voicemail because the recruiters voicemail is full, and they aren't responding to emails. 

Top talent is being pushed out due to lack of vision, direction, and leader support. I've been Game Changer for 2 years in a row and am actively looking for employment outside of Intuit. My leadership team's actions speak louder than words and they have shown me, my career development, work / lift balance, and passions are not important to them. Leaders talk about listening to employees and being open to feedback, but treat it as a box to check.",2.0,2.0,1.0,3.0,4.0,1.0
Wed Jul 31 2019 01:58:01 GMT-0700 (Pacific Daylight Time),,,Current Employee ,Amazing leadership,I have been working at Intuit full-time for more than 3 years,1,"Deep customer empathy, design thinking, benefits, work life balance, team collaboration, autonomy, global approach, community involvement","Politics get in the way, segmented products, outdated technology",,5.0,4.0,5.0,5.0,5.0,5.0
Thu Aug 01 2019 09:20:46 GMT-0700 (Pacific Daylight Time), Tax Expert,"Remote, OR",Current Employee ,"Innovative, well managed company",I have been working at Intuit full-time for more than a year,,The company is well managed. The remote nature of the job and the flexible schedule provides a lot of autonomy.,I could not think of any,,5.0,5.0,5.0,5.0,4.0,5.0
Thu Aug 01 2019 14:46:34 GMT-0700 (Pacific Daylight Time), Staff Software Engineer,,Current Employee ,Blessed to work here,I have been working at Intuit full-time,,Benefits. Location. Work Culture. Pay. Smart coworkers,"Can get political at times
-Tricky promotion process",,5.0,5.0,5.0,5.0,5.0,5.0
Tue Aug 06 2019 22:23:39 GMT-0700 (Pacific Daylight Time), Staff Software Engineer,"Mountain View, CA",Current Employee ,A company which is particular about maintaining its brand and good image,I have been working at Intuit full-time for more than 3 years,6,"Good salary, bonus and stock options
Cool office and respected brand name
Industry leading products","Very high employee attrition. Most employees cannot stay for more that 2-3 years. Either one has to be working on a successful project or belong to a clique to stick around. 
Every year spring a musical chair of who will stay and who will let go happen, an ugly blame game will follow breaking people's spirit and sense of personal dignity, one could witness adult men crying. 
Once all the dirty business is taken care, company will have a song and dance summer party where the CEO will crack jokes in his southern folksy accent and CFO will talk about how all accounting books are looking great (with reduced financial liability).
Come summer, they will hire younger, cheaper and fresher faces who will continue to fuel its innovation engine.
Afterall, people are disposable.","Break the hidden inner tribes and cliques
Question whether such high attrition results in gained productivity",2.0,4.0,2.0,3.0,4.0,3.0
Tue Jul 30 2019 15:44:18 GMT-0700 (Pacific Daylight Time), Senior Data Engineer,"Plano, TX",Current Employee ,Good Place to Work,I have been working at Intuit full-time for more than 3 years,5,"Really live their values, high on integrity and doing right by customers & employees first. Great culture with people who really want to make a difference. Benefits outside of cash compensation are great. Innovation and bold leaps are encouraged, celebrated","Middle management too protected and empowered. Taking in world class talent at the bottom and best of the best make it to the top, but the middle if full of org structures that can be their own toxic pits. One bad leader and your comp, career outlook, and day to day life sucks...Pretend to care about employee opinion/feedback, but no serious changes are made to fix known issues. Also lots of legacy technology and thinking, manual processes live for decades.","Stop affording middle management the protection and total benefit of the doubt. Empower individual contributing employees to be the difference and get things done, take their opinions over that of directors when entire group is sending consistent message of issues.",4.0,5.0,5.0,4.0,4.0,5.0
Mon Jul 29 2019 15:43:44 GMT-0700 (Pacific Daylight Time), Senior Manager,,Former Employee ,"Great Company, great leadership in key positions, and bright future",I worked at Intuit full-time for more than 10 years,,"Intuit offers a great total compensation package. Leaders across the organization are taking training to drive strong leadership capabilities across the company, diversity and inclusion is on the right path and becoming apart of the DNA, and the company will only continue to grow with the onslaught of big data and AI.",Long term employees can be underpaid versus the market for the same position.,Sasan is a great CEO...but he is an even better person. Continue to improve daily!,5.0,4.0,5.0,4.0,4.0,4.0
Tue Jul 30 2019 20:30:37 GMT-0700 (Pacific Daylight Time), Senior Engineer,"San Diego, CA",Current Employee ,Full time is awesome but contractors have the cards stacked against them,I have been working at Intuit full-time for more than 3 years,5,"* Excellent and competitive pay for full time and contractors.
* Great Culture and professionalism.
* Medical and health benefits by far exceed everywhere else.
* A lot of social events throughout the year including supplied alcohol.
* Depending on team the work life balance is flexible.
* Insane amount of maternity and paternity leave.","* Contractors are second class citizens.
* Converting to full time from contractor is extremely difficult and rare because of the companies college hiring program being the number one priority next to diversity.
* Intuit is an echo chamber of new college grads with no practical experience.
* Managers tend to be more engineer types than diplomats with a spine.
* Really needs scrum masters because product manager and dev managers are horrible at this function.
* Promotion process is completely arbitrary and treated like new hire interviews and judged by people who have not directly worked with you or have seen your work, growth or performance.
* Shaming of bugs company wide.","* Give your contractors more respect and if they have proven themselves you need to start making offers. Why the heck would you have someone for 18 months and invite them back after a 3 month go away just to invite them back. If they are worthy to come back then they should become full time employees because you just had an 18 month trial with someone proven and not an unknown entity straight out of college.
* Your recruiters need to not focus on metrics about diversity. First go for the most qualified. I've had recruiters practically tell assessors to make yes decisions because of diversity candidates.",3.0,4.0,3.0,3.0,5.0,2.0
Mon Jul 22 2019 11:19:49 GMT-0700 (Pacific Daylight Time), Diversity and Inclusion Leader,"Mountain View, CA",Current Employee ,Amazing Mission and Leadership,I have been working at Intuit full-time for more than 10 years,1,"I love working at Intuit for three reasons: I'm making an impact, I'm learning and growing my career, and I feel connected to my colleagues. We Power Prosperity Around the World, and we're transforming the financial lives of our customers. Intuit is driven by customer empathy and caring for our team members.",We're working hard to share the Intuit story more broadly in industry. We need to continue to invest in our brand.,Keep being bold! I love the transformation under way!,5.0,5.0,5.0,5.0,5.0,5.0
Wed Jul 24 2019 18:35:46 GMT-0700 (Pacific Daylight Time), Seasonal Tax Expert,,Current Employee ,Tax Expert,I have been working at Intuit part-time,,"Good, flexible job working from home.",None that I can think of.,,5.0,5.0,5.0,4.0,,
Tue Jul 23 2019 10:26:12 GMT-0700 (Pacific Daylight Time), Executive Assistant,"Mountain View, CA",Current Employee ,the best company to work for,I have been working at Intuit full-time for more than a year,,"great people, great management style, C-level is great, great benefits","more vacation time, but it was just increased to 4 weeks",,5.0,5.0,5.0,5.0,5.0,5.0
Tue Jul 23 2019 13:16:15 GMT-0700 (Pacific Daylight Time), Senior Marketing Manager,"Mountain View, CA",Current Employee ,Truly a great place to work for in the Bay Area,I have been working at Intuit full-time for more than 3 years,,"Employee benefits, working from home leniency (depending on manager), work/life balance, and everyone in the company is always willing to help.","Your experience at Intuit will greatly vary on your manager, team, and extended team. I had a horrible manager when I first started but it improved over time through the trust of some great people.","Usually when an employee complains about his/her manager, it should be taken seriously. If the goal is to retain talent, it will be hard if the people managers who lack people manager skills continue to manage said talent.",5.0,5.0,5.0,4.0,5.0,3.0
Mon Aug 05 2019 20:55:58 GMT-0700 (Pacific Daylight Time), Senior Data Scientist,,Current Employee ,Good Company,I have been working at Intuit full-time,,Benefits and work/life balance is good,Slow Decision making and very hierarchical,,3.0,5.0,3.0,1.0,3.0,4.0
Mon Jul 22 2019 08:44:58 GMT-0700 (Pacific Daylight Time), Tax Expert,,Current Employee ,Great place to work,I have been working at Intuit part-time for more than a year,,"Flexibility 
Work from home 
Team support",Hard to get in touch with management,,5.0,5.0,5.0,5.0,5.0,4.0
