date,employee_title,location,employee_status,review_title,years_at_company,helpful,pros,cons,advice_to_mgmt,rating_overall,rating_balance,rating_culture,rating_career,rating_comp,rating_mgmt
Thu Nov 14 2019 20:25:39 GMT-0800 (Pacific Standard Time), Technical,,Current Employee ,Great Company,I have been working at VMware full-time,,Best company I've ever worked for,Should have figured out a way to work here a long time ago.,Stay the course with great leadership,5.0,5.0,5.0,5.0,5.0,5.0
Mon Jun 24 2019 13:28:33 GMT-0700 (Pacific Daylight Time), Software Engineer,"Palo Alto, CA",Former Employee ,Great place to work that values quality of life and family,I worked at VMware full-time for more than 8 years,50,"VMware is a big company but in many ways had a startup vibe. That was great because the resources and infrastructure of a big company were there, but it gave most people I worked with freedom to work on many projects, influence, move around, and contribute in many ways. Plus, many things moved faster than they might at other companies of the same size. Perks were really great including bonuses, events on the campus, opportunities, etc.","The biggest con is the annual layoff. During most of the years I was there, we were growing like crazy, beating expectations, gaining in stock price, etc. It was always positive and upward. However, every single January, it was known that there would be a round of layoffs, even when all numbers were looking great as they almost always were. Management called it restructuring. But, over the years, some really good people were let go for no apparent reason. Then to add insult to injury, a week or two later, there would be a company quarterly meeting discussing how VMware was doing so well and is still hiring, but they had to make some changes. It always felt dishonest and the sympathy for those let go came across as disingenuous.",January was always a nerve racking month and it completely destroyed any sense of loyalty to the company. I know a few people that completely changed their perception of VMware after a colleague of theirs was let go with no apparent rhyme or reason. Many people left shortly after as a result of losing loyalty to the company or for just being stressed out about themselves getting cut the next year.,5.0,5.0,4.0,4.0,4.0,1.0
Tue Nov 12 2019 20:33:44 GMT-0800 (Pacific Standard Time), Member of Technical Staff,,Current Employee ,Awesome work,I have been working at VMware full-time,,I loved the culture and team,All was good and nothing as much,Keep it up. Awesome place to work for!,5.0,5.0,5.0,5.0,5.0,5.0
Mon Nov 11 2019 16:41:43 GMT-0800 (Pacific Standard Time), MTS3,,Current Employee ,Good engineering culture and work life balance,I have been working at VMware full-time,,Good engineering culture and work life balance,RSU refreshers have been on decline,,5.0,,,,,
Tue Nov 12 2019 09:56:33 GMT-0800 (Pacific Standard Time), MTS2,"Atlanta, GA",Current Employee ,Excellent work life balance & Engineering culture,I have been working at VMware full-time for more than a year,,Excellent work life balance & Engineering culture,RSU refresher have been on decline,,5.0,,,,,
Sun Nov 10 2019 12:36:47 GMT-0800 (Pacific Standard Time), MTS1 Software Engineer,,Former Employee ,Awesome experience. Lot of learning,I worked at VMware full-time,,Lot of learning Flexible timing Friendly employers,I cannot think of any cons,,5.0,,,,,
Thu Nov 14 2019 22:45:00 GMT-0800 (Pacific Standard Time), Senior Program Manager,,Former Employee ,"Great company, depending on your manager",I worked at VMware full-time for more than 8 years,,The company vision and strategy are truly inspiring. Benefits are excellent. VMware has amazing people to work with!,Your manager can make your life miserable and is allowed to do so. Working up the management chain to get relief is useless. HR is useless. No ability to transfer if your manager does not support the transfer.,"Pay attention to what many prior employees say about power hungry, micro-managing, controlling managers. This has driven many stellar employees away.",4.0,5.0,5.0,3.0,5.0,3.0
Wed Oct 30 2019 10:03:24 GMT-0700 (Pacific Daylight Time), Prefer Not to Answer,"Palo Alto, CA",Former Employee ,Great Culture and Great People,I worked at VMware full-time for less than a year,,The people who work here are incredibly friendly and enjoy coming into work every day. The hours are flexible and the focus is in the value that you have to the company and what works best for your schedule rather than mandating a rigid 9-5 schedule.,"It is a large company that recently went through a reorganization, so a lot of individuals were still trying to figure out their new roles and how they fit into the grand scheme. Overall though I believe the company did a good job detailing the new structure and goals.",,5.0,5.0,5.0,5.0,5.0,5.0
Mon Nov 11 2019 13:55:56 GMT-0800 (Pacific Standard Time), Sales,"Palo Alto, CA",Former Employee ,vmware palo alto,I worked at VMware full-time for more than a year,,"great tech, strong vision, relevant in the market",Lots of policies and politics,,4.0,3.0,4.0,4.0,4.0,4.0
Tue Oct 22 2019 16:46:30 GMT-0700 (Pacific Daylight Time), Business Systems Analyst,"Austin, TX",Former Employee ,One of the best employers,I worked at VMware full-time for more than 3 years,,"Great company - Good culture, lots of opportunities to learn, Great benefits",Not many - typical of a larger company,,5.0,5.0,5.0,4.0,5.0,5.0
Sun Sep 15 2019 13:47:47 GMT-0700 (Pacific Daylight Time), Principal Architect,"Palo Alto, CA",Former Employee ,Best place I have ever worked,I worked at VMware full-time for more than 5 years,11,"VMware is a much loved brand, with a massive community following in the industry. The premises (see what I did there) at Palo Alto HQ is a joyful place to work. There are several restaurants onsite, with coffee, ice cream, and every building has at least one kitchen stocked with soda, espresso machines, healthy and unhealthy snacks, peanut butter, bread, fruit, you name it. Over the years I have brought my family here to see the turtles, watch seasonal events that they throw, and even feed the turtles.

As for the technology, VMware have there staple diet of vSphere, but don't be fooled into thinking this is still just a virtualization company. With acquisitions such as Nicera that made NSX possible, and features such as vSAN, their staple diet is strong. Over recent years they have brought in some amazing talent, and the technical leadership is second to none. I'm talking about Chris Wolf, Joe Baguley, Bruce Davie, Christos Karamanolis, and Kit Colbert just to name a few.

What makes VMware successful today isn't just their core vSphere platform, but their ability to run it successfully in the public cloud (AWS, Google, Azure) and now bring in containers. I should also mention that in my day to day interactions with customers, other lesser known products such as vRealize Operations, Automation, Orchestrator, vCloud Director and Log Insight mean this is truly a world-class enterprise solution.

I know that many of you will be thinking I am talking like a 'fan boi', well maybe, but you must realize (pun intended) that this is the heart of what VMware is about. There is a real passion, especially among the technical engineering BUs, including the field (PSO, SE), for what VMware is about.

Pat Gelsinger was voted #1 CEO, and during my time there I had personally received emails from him in response to feedback I gave. There are not many other companies with over 22,000 employees that get this level of attention. He is also extremely committed to the community I was talking about. At VMworld this year (2019) he was at two community events in person, talking with both employees and customers.

During my time at VMware I worked in two countries, across 3 different business units, and what a ride.","Like any company there are some bad people, however I still hope this is the minority at VMware.

Unfortunately it was the actions of one particular individual which led me to leave the company. My successful trajectory came to a sudden stop due to this person. My manager.","Read my cons above. I actually took this particular issue to senior (VP level) leadership. While I felt supported and was offered an alternative team to work with, no action was taken on this person. Nothing at all. I didn't even know if (or how) there was a process to report this to HR without logging an internal ticket, and I feared he would see it.

Please look after your most talented staff, and watch for bad management. Remember, people don't leave companies, they leave managers.",5.0,5.0,5.0,5.0,5.0,4.0
Sat Oct 19 2019 07:06:37 GMT-0700 (Pacific Daylight Time), Director,,Former Employee ,"Culture, Market Leader, People!",I worked at VMware full-time for more than 8 years,,Visionary CEO will go down as a legend in Tech history!,Growing Pains to continue on a double digit growth trajectory towards 10B.,,5.0,3.0,5.0,5.0,5.0,4.0
Wed Oct 30 2019 10:21:44 GMT-0700 (Pacific Daylight Time), Senior Solutions Engineer,,Current Employee ,Its all in the Name!,I have been working at VMware full-time for less than a year,,Very smart people! Very cutting edge!,Commissions are tough when working under a team quota.,Align SE's to sales AE,4.0,5.0,5.0,5.0,3.0,5.0
Fri Oct 11 2019 23:58:08 GMT-0700 (Pacific Daylight Time), Senior Manager,"Palo Alto, CA",Current Employee ,"Great culture, leadership and smart people",I have been working at VMware full-time for more than 3 years,,"VMware acts on its core EPIC2 values - Execution, Passion, Integrity, Customer and Community. Work/Life balance is good, and people are smart and supportive.",Nothing I can think of right now,Continue to execute EPIC2 values.,5.0,4.0,5.0,5.0,4.0,4.0
Sun Oct 20 2019 21:53:13 GMT-0700 (Pacific Daylight Time), MTS3,"Burlington, MA",Former Employee ,Find the right manager and you will be happy,I worked at VMware full-time for more than 3 years,1,"Great benefits. Great salary. Great brand name.

If you are applying to their vRA team in the Burlington MA branch, you need to be aware which team you are interviewing for. There are two managers for the VRA team at their Burlington MA office. One of the manager's team has a great culture where the smartest thrive.
The other manager hires people mostly from one specific country. He avoids Americans probably because his ability to manipulate and oppress them is lesser. His team is extremely toxic with hand picked idiots on the top. Idiots who are very loyal to him and will never revolt against him.",Join the right manager's team and be happy. Join the wrong manager's team and expect to descend into a hell of dirty politics and sucking up.,,3.0,4.0,3.0,3.0,5.0,2.0
Mon Oct 07 2019 13:31:27 GMT-0700 (Pacific Daylight Time), Senior Account Executive,"Des Moines, IA",Former Employee ,Great Company,I worked at VMware full-time for more than 3 years,,Great Leadership with very smart people,Currently no Cons to report,,5.0,5.0,5.0,4.0,4.0,5.0
Mon Oct 21 2019 09:22:38 GMT-0700 (Pacific Daylight Time), Senior Manager,"Palo Alto, CA",Current Employee ,Good work culture,I have been working at VMware full-time for more than 8 years,,Very good work culture; innovation is valued;,fair amount of politics up the ranks,hold teams accountable for success,4.0,5.0,5.0,3.0,3.0,3.0
Sun Oct 20 2019 00:03:07 GMT-0700 (Pacific Daylight Time), Senior User Experience Designer,,Current Employee ,VMware,I have been working at VMware full-time for more than 5 years,,Great company to work for,Engineer driven over design culture,,4.0,,,,,
Thu Nov 07 2019 20:47:42 GMT-0800 (Pacific Standard Time),,, ,Hit or miss,I worked at VMware,3,"Nice company grounds
Cutting edge tech","Depends on the team you join. Some managers dedicate their life to the company and do not understand there is a life outside work. 
There is limited wfh flexibility, numerous social dinners, and lack of opportunity to progress. 
Long hours, and not giving enough days off during down time to offset the busy times. 
Heavy Nepotism. Promoting managers without grooming them.
""Unlimited PTO"" per say, but the truth is the company is robbing your hours.
Some personal is highly toxic but their are surrounded by their minions.","If you want your employees to continue working for you, treat them like a professional, giving them flexibility and autonomy. Not like a factory worker and micromanaging",1.0,1.0,1.0,1.0,2.0,1.0
Thu Oct 17 2019 12:27:24 GMT-0700 (Pacific Daylight Time), Product Manager,"Palo Alto, CA",Former Employee ,Ethical employee friendly company,I worked at VMware full-time for more than 3 years,,"VMWare is an ethical, employee friendly company. Customers love its products and VMware tries to make sure that a customer is at the center of their product decisions. It's a nice place to work and if you are in the right team, you get to work on cutting edge technology.","There is a general lack of accountability at VMWare, which is troubling. Middle management politics can get very ugly.",Please promote accountability at VMware.,4.0,,,,,
Sat Oct 12 2019 17:06:05 GMT-0700 (Pacific Daylight Time), Senior Consulting Manager,"Palo Alto, CA",Current Employee ,"Interesting products, low salaries",I have been working at VMware full-time for more than 3 years,2,great colleagues. the strategy goes to the right direction.,additional (or any) leadership training for the manager (absolutely required!). Compensation package ist NOT market-comfort (salaries are under the market average),Keep up the good work but please pay more attention to the leadership skills and experience of the managers (more focus on people). The salary part is essential and one of the most important factors to keep your employees motivated.,3.0,3.0,3.0,3.0,3.0,3.0
Wed Oct 16 2019 12:02:03 GMT-0700 (Pacific Daylight Time), Client Executive,"Washington, DC",Current Employee ,Doing Good,I have been working at VMware full-time for more than a year,,Fast pace work environment. Great products!,Do more with a lot less. On the job training. Hi turn over.,,3.0,3.0,3.0,3.0,4.0,2.0
Tue Oct 15 2019 11:36:09 GMT-0700 (Pacific Daylight Time), Channel Manager,"Chicago, IL",Current Employee ,Americas Channels Lack Direction,I have been working at VMware full-time for more than 3 years,1,Company is great overall from a benefits and longevity perspective. Decent products and great marketing.,Horrible management in the channel. No wonder Oracle Channel business sucked.... poor leadership. Americas leader too busy managing up the chain. No strategy and direction.,Dump Americas channel leader. Capture more market share with partners with a good leader that doesn’t repeat the same old Message over and over.,2.0,3.0,4.0,5.0,5.0,4.0
Fri Oct 11 2019 08:36:18 GMT-0700 (Pacific Daylight Time), Sales,,Current Employee ,"Good tech and culture, constant changes",I have been working at VMware full-time,," Great benefits, people, and perks
- Technology that you can be confident in as the best in breed 
- Executive level leadership has a clear plan how to remain relevant for the future", Constant internal re-structuring makes it challenges to gain footing,,4.0,4.0,4.0,5.0,5.0,
Wed Sep 25 2019 22:13:36 GMT-0700 (Pacific Daylight Time), Client Executive,"Salt Lake City, UT",Current Employee ,Diverse and Inclusive,I have been working at VMware full-time for more than a year,,Fantastic company with a very diverse and inclusive culture.,Those that work remote can sometime feel isolated and missing out on the perks of being at HQ or in am office.,,5.0,5.0,5.0,4.0,4.0,4.0
Mon Sep 23 2019 15:00:30 GMT-0700 (Pacific Daylight Time), Engineer,"Palo Alto, CA",Current Employee ,Awesome Company to Work For,I have been working at VMware full-time for more than 3 years,,"Smart people, get it done attitude, great environment, great benefits",A mentorship program would have been good,,5.0,5.0,5.0,4.0,4.0,4.0
Wed Sep 18 2019 20:08:16 GMT-0700 (Pacific Daylight Time), Director,"Palo Alto, CA",Former Employee ,Great people,I worked at VMware full-time for more than 10 years,1,"By and large, the people at VMware are great people to work with. Very bright and eager to find solutions to some of the trickiest problems facing the industry. There's an emphasis on focus and execution, but the culture is more supportive than internally competitive. The benefits are great and the Palo Alto campus is gorgeous.","Some challenges with cross-organizational silos and communication. Depending on the business unit, annual budget planning processes can be fairly lengthy and opaque which is frustrating if you're exposed to it.",,5.0,5.0,5.0,5.0,5.0,4.0
Sun Sep 22 2019 13:54:42 GMT-0700 (Pacific Daylight Time), Senior Director,"Palo Alto, CA",Former Employee ,"Fast Growing, Loved by Customers",I worked at VMware full-time for more than 8 years,,"Product-led company that has evolved and thrived over the years, even in the face of competition.","Like all large companies, red-tape / bureaucracy can be frustrating.",More empowerment to all levels within the organization.,5.0,4.0,4.0,5.0,4.0,5.0
Wed Oct 02 2019 09:05:54 GMT-0700 (Pacific Daylight Time), Product Line Management,"Palo Alto, CA",Current Employee ,Good retirement place,I have been working at VMware full-time for more than 3 years,,"Less stressful work, good salary, generous travel benefits","Overstaffed , so too many internal nonsense initiatives",Cut budget by 50% and see if business still grows across traditional business units,4.0,5.0,5.0,4.0,5.0,2.0
Wed Sep 11 2019 12:38:27 GMT-0700 (Pacific Daylight Time), UI/User Experience Designer,"Atlanta, GA",Current Employee ,Excited!,I have been working at VMware full-time for less than a year,1,"My team is composed of very smart and very kind people who work well together. We get stuff done! I've only been here a few months, but they are very understanding of my career change and are helping me learn the ropes and the company as time goes by (even though they were very busy when I first started with many things going on, so I appreciate their help!). 

I get to work from home as much as I want and have yet to take any PTO, but the unlimited PTO option is pretty cool and I look forward to utilizing that in the future when I need to. Orientation was AWESOME, and I learned so many soft skills I didn't even realize I was lacking. This company really seems to care about culture and treating employees with respect. I look forward to using the skills they taught me to help the company in keeping to their high standards. 

It seems from other reviews that managers can make or break your time here. So far my managers and teammates have been nothing less than stellar and just so cool, so I feel my time here will continue to be a 5 star rating. I'm excited to keep learning and honing my skills and giving the best work possible.

The interview process for my position was grueling but honestly I feel in hindsight it was a pro. It really helped to encourage me that my skills were up to par with what they were looking for.","Orientation didn't happen until 3 months after I was hired. Felt very lost as to who and what VMware was exactly, and still am not entirely sure what the different softwares I'm working on are about (I don't come from a tech background). I've been told a few times but there's so many different ones, and new features constantly being added, and they can sound so complicated that it's hard to keep it all straight. I'm sure with time this will get easier though.",I feel there could definitely be a better on-boarding process for newbies. Maybe a packet that goes over everything more in depth that's related to that specific role? Orientation should probably be within the first month of being hired to help us understand the company values and our place in it better.,5.0,5.0,5.0,5.0,5.0,
Tue Sep 24 2019 10:34:12 GMT-0700 (Pacific Daylight Time), Smts,,Current Employee ,Great Company,I have been working at VMware full-time for more than 8 years,,Lots of new technologies to work on.,Commute to work is very bad.,,3.0,2.0,3.0,2.0,2.0,3.0
Sat Aug 31 2019 10:47:53 GMT-0700 (Pacific Daylight Time), Customer Success Manager,"Santa Clara, CA",Current Employee ,"Great, big company",I have been working at VMware full-time for less than a year,1,"Awesome benefits, lots of opportunity for growth",Cannot think of any right now,,5.0,4.0,4.0,5.0,5.0,4.0
Fri Aug 30 2019 14:31:14 GMT-0700 (Pacific Daylight Time), Client Executive,"Phoenix, AZ",Former Employee ,SLED,I worked at VMware full-time for more than 3 years,,"Unlimited PTO, strong market share, great benefits","Unreasonable Quotas, complicated comp system, frequently changing processes",,5.0,4.0,4.0,5.0,5.0,3.0
Thu Aug 15 2019 08:17:22 GMT-0700 (Pacific Daylight Time), Consulting Architect,"Palo Alto, CA",Current Employee ,Everything you hear about VMware is true!,I have been working at VMware full-time for more than 5 years,4,"Outstanding culture, technology leader. I often tell people that working at VMware is the most difficult, but also most rewarding position I've held in over 20 years. VMware won't spoon-fed you, but will ensure that you are given the tools and opportunities to go as far as you want. Your success at VMware is directly tied to your effort that you put in.","Compensation is little below other technology companies in the Bay area. Some career paths, particularly those in Professional Services, have a limited path.","Keep doing what you're doing. Live the EPIC2 values. Continue to be inclusive, as that makes us a stronger company. Partnerships with other companies such a Microsoft, Amazon and Goggle are absolutely a move in the right direction.",5.0,4.0,5.0,4.0,4.0,5.0
Wed Sep 11 2019 13:16:26 GMT-0700 (Pacific Daylight Time), Senior Financial Analyst,"Palo Alto, CA",Former Employee ,Amazing place to work,I worked at VMware full-time for more than 3 years,,Open minded culture and nice people overall,Working hour were too long sometimes,,4.0,4.0,5.0,4.0,3.0,5.0
Mon Sep 09 2019 20:16:06 GMT-0700 (Pacific Daylight Time), Open Cloud Expert,"Palo Alto, CA",Former Employee ,Great Experience and Most Professional Work Environment,I worked at VMware full-time for more than a year,,"Learning opportunities, *very* clear career progression, great compensation and real challenges. The level of professionalism and respect at VMware is unmatched. Great place to work.","The pressure to learn new technologies is intense, and the high stakes for some of the work can be stressful.",Make it easier to work at overseas offices.,4.0,4.0,5.0,5.0,5.0,4.0
Thu Sep 05 2019 22:43:07 GMT-0700 (Pacific Daylight Time), Staff Engineer,"Palo Alto, CA",Current Employee ,Great company in general with downsides of being a large company,I have been working at VMware full-time for more than 8 years,1,"Great benefits, and work environment",Lots of politics as expected from any big company. I think vmware has a bit more of it.,"Top 3 levels of execs need to get back in touch with the roots of the company i.e. the engineers. Seems like with multiple layers of management, due to some bad actors the engineering teams suffer badly.",4.0,3.0,3.0,3.0,3.0,1.0
Wed Aug 21 2019 20:44:15 GMT-0700 (Pacific Daylight Time), Senior Member of Technical Staff,"Palo Alto, CA",Current Employee ,Great company with smart ppl,I have been working at VMware full-time for more than 5 years,1,Good place to work if you are into systems programming,Soccer field badly needs work !,,5.0,5.0,5.0,5.0,4.0,3.0
Wed Sep 04 2019 19:59:17 GMT-0700 (Pacific Daylight Time), TSE II,"Broomfield, CO",Current Employee ,Great for career development / work life balance not so great,I have been working at VMware full-time for more than 3 years,2,You will become a battle hardened engineer,Will get worked to death after they get you ramped up,Could use a lot more transparency between employees and leadership especially when it comes to preparing for upcoming products that will be supported. This would help a lot by allowing employee input and buy in direction the company is going,3.0,2.0,2.0,3.0,2.0,2.0
Fri Aug 23 2019 10:24:28 GMT-0700 (Pacific Daylight Time), Staff Engineer,"Palo Alto, CA",Current Employee ,"Great company, good benefits",I have been working at VMware full-time for more than 8 years,,"Great company, good salary, great benefits","Over staffed, certain departments are fast paced",,5.0,5.0,5.0,5.0,5.0,3.0
Thu Sep 05 2019 08:53:33 GMT-0700 (Pacific Daylight Time), Member of Technical Staff,"Palo Alto, CA",Current Employee ,Work life balance well company,I have been working at VMware full-time for more than a year,,A lot of projects can be done. But work-life balance is good.,Promotion is slow and a lot of maintenance work in my team.,,4.0,5.0,4.0,4.0,3.0,4.0
