date,employee_title,location,employee_status,review_title,years_at_company,helpful,pros,cons,advice_to_mgmt,rating_overall,rating_balance,rating_culture,rating_career,rating_comp,rating_mgmt
Mon Apr 29 2019 21:29:09 GMT-0700 (Pacific Daylight Time), Engineer,,Former Employee ,"Accept offers with caution. Excellent CEO, bad middle management.",I worked at VMware full-time for more than a year,6,"Excellent growth .
Excellent product portfolio.
Excellent CEO.

 Pat Gelsinger the CEO has done an awesome job of taking over the reigns of the company a few years ago and completely turning it around. The stock price has more than quadrupled under his leadership. He has acquired many startups and successfully integrated them into the VMWare product portfolio and eco system. Hats off to him for creating wealth for the employees, for the owners (EMC and now DELL) and for the investors. One of the finest CEO in the Silicon Valley.","Along with these product acquisitions, this company has also acquired managers and middle management who have no idea of what management is. There is no one culture at VMWare. There are as many cultures as the number of startups acquired and the managers of these startups are free to treat their teams as they want. HR is very weak in this company and they are not for you. They are for the managers ... dont rely on them. 

I had a short stint at one of these acquired startups called Velocloud. Incompetent management, very high attrition rate. Lot of senior engineers leaving the group. Those who stick around are there to vest their stocks. The founders thinks of themselves to be semi god who will punish you if you decide to leave their kingdom. Their technology stack will teach you nothing. Accept their offer if you cannot find a job somewhere else.

Most of these startup managers lack sympathy and empathy and will not hesitate to show you their powers and make you feel that you are a POS compared to them.

Dont be fooled by the ""100 Best Companies to Work"" or ""Top paying company"" marketing or the campus. It is actually an average paying and a very weak middle management company. Shop around, I am confident you will get a much better offer and a lot better culture, work environment and work life balance. I know people who were offered twice the package they were making at VMWare.",Pat: VMWare is doing an awesome job and will continue to do so under your excellent leadership. Fix the culture and HR of this company. Let HR be for the engineers also and not just for the managers.,2.0,2.0,1.0,3.0,3.0,1.0
Sat May 04 2019 14:37:00 GMT-0700 (Pacific Daylight Time), Staff Engineer,"Palo Alto, CA",Current Employee ,Nice company less nice management,I have been working at VMware full-time for more than 3 years,1,"Decent compensation, nice campus, generally nice people to work with",Inept IT and management. NSBU senior management suffers from nepotism and lack of technical understanding,,4.0,2.0,3.0,3.0,3.0,2.0
Tue Apr 16 2019 08:56:33 GMT-0700 (Pacific Daylight Time), Senior Engagement Manager,"Boston, MA",Former Employee ,Great Company to Work for,I worked at VMware full-time for more than a year,1,Great people; flexible hours and option to work from home.,limited options for career development,,5.0,4.0,5.0,2.0,5.0,4.0
Mon Apr 01 2019 09:21:05 GMT-0700 (Pacific Daylight Time), Staff Engineer1,"Palo Alto, CA",Current Employee ,Great company,I have been working at VMware full-time for more than 10 years,5,It is a great software company to work for and build your career. Some areas not good but there are a lot of good and upcoming areas or the really old areas that made VMware what it is.,Too much bureaucracy and politics has crept into the organization at director and VP levels.,,5.0,4.0,5.0,4.0,4.0,4.0
Sun Apr 28 2019 20:12:14 GMT-0700 (Pacific Daylight Time), Marketing,"Palo Alto, CA",Current Employee ,Don't treat people well,I have been working at VMware full-time for more than 3 years,1,"Salary, decent work life balence","No longer nimble or innovative, VP and above way to many politics for a medium sized co. IQ and EQ failing",,2.0,3.0,2.0,2.0,3.0,2.0
Mon Apr 22 2019 11:47:41 GMT-0700 (Pacific Daylight Time), Partner Sales Manager,"Chicago, IL",Former Employee ,Solid Employer,I worked at VMware full-time for more than 5 years,2,"Good entry salary (100k+ for all sales roles), 401k match, unlimited PTO, employee stock purchase program, signing bonus (restricted stock units).","Onboarding process is terrible, sink or swim mentality, very little professional development. Raises are limited and promotions don't include significant salary bumps.",,4.0,5.0,2.0,5.0,4.0,3.0
Sat Apr 20 2019 07:29:03 GMT-0700 (Pacific Daylight Time), Staff Engineer,,Current Employee ,"Great Company and CEO, Bad middle management,",I have been working at VMware full-time for more than 10 years,,"* They are lot in Charity and support community. 
* Good salaries
* Talent is top notch. 
* Women got better career path here.","* Recent change in Health benefits are horrible. Pretty much they want to shove HSA option to you. Medical bills from providers are not discounted anymore from this year, so it has become expensive for you and your family to manage medical with VMware.
* Sr. Director and VP are bringing developer productive numbers in employee directory. It is becoming hostile environment. 
* vmwomen has some bad side effects. Some of them are not deserved to be leader. 
* no work life balance",Change the middle layer. It is becoming land of bureaucrats who are disturbing the work culture.,3.0,2.0,4.0,4.0,5.0,2.0
Thu Mar 28 2019 13:14:10 GMT-0700 (Pacific Daylight Time), Marketing Manager,"Palo Alto, CA",Current Employee ,Excellent Company,I have been working at VMware full-time for more than 3 years,2,"Great leadership, incredible culture, generous benefits, and meaningful work.",The only constant is change. Also a pro!,,5.0,4.0,5.0,5.0,4.0,5.0
Wed Apr 17 2019 09:01:12 GMT-0700 (Pacific Daylight Time), Senior Manager,"Palo Alto, CA",Former Employee ,Work Culture,I worked at VMware full-time for more than 8 years,,Very positive working at vmware IT. Talented team and plenty of work to do and build a career,If you are a person who don't like to put long hours working across the geo's - this is not for you,,4.0,3.0,4.0,4.0,4.0,3.0
Thu Mar 28 2019 18:02:38 GMT-0700 (Pacific Daylight Time),,,Current Employee ,Great place to work,I have been working at VMware full-time for more than 3 years,1,"The technology is top rate, great corporate culture, beautiful campus",Sometimes teams are too siloed.,,5.0,5.0,5.0,4.0,5.0,5.0
Tue Apr 09 2019 22:45:14 GMT-0700 (Pacific Daylight Time), Staff Engineer,"Palo Alto, CA",Former Employee ,there's still some hope!,I worked at VMware full-time for more than 5 years,,"the people, the tools (obviously depends on the group you are in)",some groups are now in maintenance mode.,,4.0,4.0,4.0,4.0,4.0,4.0
Sun Mar 17 2019 21:04:31 GMT-0700 (Pacific Daylight Time), Financial Analyst,,Former Employee ,Great Intern Program,I worked at VMware full-time for less than a year,1,"Very great environment to learn in, fun company events, great internship program",Average age is older and less exciting for the younger crowd,,5.0,5.0,5.0,5.0,5.0,5.0
Wed Mar 27 2019 17:04:10 GMT-0700 (Pacific Daylight Time), Digital Marketing Specialist,"Palo Alto, CA",Former Employee ,Opportunity Abounds,I worked at VMware full-time for more than 3 years,1,"Salary, bonus, unlimited time off, beautiful campus","Perpetual intensity, re-orgs, battling business units","Great place to work, just be sure to walk the talk.",4.0,2.0,5.0,3.0,5.0,4.0
Sat Mar 30 2019 10:33:59 GMT-0700 (Pacific Daylight Time), Smts,,Current Employee ,Great company to work for,I have been working at VMware full-time for more than 5 years,,"Work life balance, great leadership",No transparent appraisal of employees.,,4.0,5.0,5.0,5.0,5.0,4.0
Sat Mar 30 2019 14:17:48 GMT-0700 (Pacific Daylight Time),,,Current Employee ,Each organization is different but a great work atmosphere,I have been working at VMware full-time,,"Great campus, wide range of technology",as every company some business units are more fun that others.,,3.0,2.0,1.0,2.0,3.0,1.0
Fri Mar 08 2019 14:01:00 GMT-0800 (Pacific Standard Time), Sales Specialist,"Nashville, TN",Current Employee ,Great company to work for,I have been working at VMware full-time for more than a year,2,"Work life balance, benefits",No con to give at this time,,5.0,,,,,
Mon Mar 11 2019 11:28:09 GMT-0700 (Pacific Daylight Time),,,Current Employee ,Awesome place,I have been working at VMware full-time,1,Good work culture in the compsny,No cons in the compsny,,5.0,,,,,
Thu Mar 28 2019 08:24:48 GMT-0700 (Pacific Daylight Time), Inside Sales Representative,"Austin, TX",Current Employee ,"Great company, but shifting inside sales environment",I have been working at VMware full-time for less than a year,,"Excellent product, culture, and employees","Inside sales structure is being overtaken by outside sales team. Unethical account shifting or ""quota dumping"" from outside sales to inside sales.",,3.0,4.0,4.0,4.0,4.0,3.0
Wed Mar 27 2019 11:04:55 GMT-0700 (Pacific Daylight Time), Senior Solutions Engineer,"Palo Alto, CA",Current Employee ,Great company that changed the tech world,I have been working at VMware full-time for more than 5 years,,"Amazing technology, great breadth of offerings, amazing community support","Tend to hire from outside for management roles, poor career dev","Promote from within, have HR actually work with managers to help career dev",4.0,5.0,5.0,3.0,4.0,4.0
Wed Mar 06 2019 14:09:20 GMT-0800 (Pacific Standard Time),,"Palo Alto, CA",Current Employee ,Great company to work,I have been working at VMware full-time for more than 10 years,,"flexible hours
can move between team
passionate people",too much flexibility allow abuse of the system,,5.0,5.0,5.0,4.0,5.0,
Sat Mar 09 2019 22:26:13 GMT-0800 (Pacific Standard Time), Systems Engineer,"Palo Alto, CA",Current Employee ,"Going down, great in the past",I have been working at VMware full-time for more than a year,8,"Salary, training resources, PA campus
A lot of smart engineer"," Political environment is destroying the company, leadership promote their friends
- Benefits changes, company switch from Aetna to UHC to save money and seriously impacting the employees and families. HR doesn't do anything to help, just exist for administrative works
- The EPIC2 values pushed by high executives, doesn't reflect the reality on the management level. This is a serious issue across the all BUs","Review the Directors and Managers on the same position for more than 5 years, they are on the comfort zone and don't work to make their teams better, promote and coach.

Listen the employees and their concern about UHC, families are getting seriously impacted by this change.",2.0,4.0,2.0,2.0,4.0,1.0
Fri Mar 15 2019 18:57:09 GMT-0700 (Pacific Daylight Time), EUC AE,,Former Employee ,To,I worked at VMware full-time for more than a year,,"Excellent product
Easy to get in the door
Confusing product set that doesn’t really have a complete story
Great commerodery between SEs, specialists and core reps","Somewhat unrealistic goals 
Unmanageable territories 
GEH Management cares more about their image than actual excellence - not focused on customer success
Lots of finger pointing in specialist position with expectations changing quarterly 
Lower level management cares more about reports than actually having time to sell 
Layoffs just about every February 
Management hard to trust and very disconnected with real life
Lots of arrogance and fake intentions in GEH EUC","List to your reps, listen to your customers and don’t ignore the market and feedback.",4.0,3.0,4.0,4.0,5.0,2.0
Sat Mar 16 2019 11:50:07 GMT-0700 (Pacific Daylight Time),,,Current Employee ,software engineer,I have been working at VMware full-time,,"fun, challenge, perks, vacation, and more","over time, and more, and more",,3.0,4.0,3.0,4.0,3.0,3.0
Fri Mar 15 2019 08:49:04 GMT-0700 (Pacific Daylight Time), Director,,Former Employee ,Great company; great people,I worked at VMware full-time for more than 5 years,,"Great executive leadership
Great stated values
Great opportunity to learn and grow","Processes can be cumbersome
Lots of egos",,4.0,3.0,5.0,4.0,4.0,5.0
Mon Mar 11 2019 15:40:56 GMT-0700 (Pacific Daylight Time),,,Former Employee ,A great company to with,I worked at VMware full-time for more than 3 years,1,"Work culture is great
Compensation is good",career growth and development is slow,,4.0,5.0,5.0,4.0,4.0,3.0
Sun Mar 10 2019 06:59:45 GMT-0700 (Pacific Daylight Time),,,Current Employee ,Good Start of career.,I have been working at VMware full-time for more than a year,1,"People, Learning, working on a great product.","No good career path, not enough people in Denver office",,4.0,3.0,5.0,3.0,5.0,4.0
Tue Feb 12 2019 22:47:48 GMT-0800 (Pacific Standard Time), Member of Technical Staff,"Bellevue, WA",Current Employee ,Great Salary and Benefits,I have been working at VMware full-time for more than a year,3,Best Work life balance.,they donot provide parking and cut down on many privileges without informing.,,5.0,5.0,5.0,3.0,5.0,5.0
Fri Mar 01 2019 17:03:22 GMT-0800 (Pacific Standard Time), Senior Member of Technical Staff,"Palo Alto, CA",Current Employee ,"Smart People, good vision, nice benefits",I have been working at VMware full-time for more than 5 years,2,"1) Technically challenging & fulfilling
2) Management has good vision & seems to be taking the decisions as per market trends.
3) Good benefits","1) Adherence to stale technology. Only some teams get to work on latest and coolest stuff.
2) Politics like any other company of this size has.",,4.0,3.0,3.0,4.0,4.0,4.0
Mon Feb 25 2019 16:46:38 GMT-0800 (Pacific Standard Time), Senior Director,"Palo Alto, CA",Current Employee ,High growth company. Tech Leader,I have been working at VMware full-time for more than 10 years,1,Product drives growth. Innovative and leading edge. Competitive pay,Political climate increasing. Who you know is becoming more important what you can do and deliver as an employee.,Work harder to keep top talent and de-emphasize the boys club mentality,4.0,3.0,4.0,3.0,5.0,3.0
Tue Feb 26 2019 08:50:07 GMT-0800 (Pacific Standard Time),,"Palo Alto, CA",Current Employee ,Excellent work life balance,I have been working at VMware full-time for less than a year,1,"Flexibility in schedule 
Tons of resources","Lack of passion and energy
Not mission driven",,4.0,5.0,4.0,4.0,5.0,4.0
Wed Feb 27 2019 14:56:44 GMT-0800 (Pacific Standard Time), Systems Engineer,,Current Employee ,Great company and vision,I have been working at VMware full-time for more than a year,," The company has pivoted and now has many products that help customers move to the cloud.
- Good culture
- Despite being such a large company, they do a pretty good job at using social tools to engage with the employees."," If you're in the field, they like to change accounts and move territories. The is very frustrating for customers and the Sales teams.",,4.0,5.0,4.0,4.0,5.0,4.0
Tue Feb 12 2019 07:43:04 GMT-0800 (Pacific Standard Time), Inside Sales Representative,"Austin, TX",Current Employee ,Amazing Company!,I have been working at VMware full-time for more than a year,,"Work/Life Balance, Big on giving back to the community, Aggressive Pay, Lots of room for upward growth professionally, Amazing Culture, Fun atmosphere",I do not have any Cons.,,5.0,5.0,5.0,5.0,5.0,5.0
Thu Feb 07 2019 23:10:41 GMT-0800 (Pacific Standard Time), Manager,"Palo Alto, CA",Current Employee ,Great place to work,I have been working at VMware full-time for more than 5 years,1,I have been in VMware for many years and the experience has been really good. Benefits are good and the company offers a good work life balance.,"There are a lot of org changes which is quite annoying and hinders productivity,",Let there be changes in the organization but an ever changing organization definitely is not going to be fruitful and people working there are not going to be happy.,5.0,4.0,5.0,5.0,5.0,4.0
Sun Feb 24 2019 21:41:34 GMT-0800 (Pacific Standard Time), Senior Manager,,Current Employee ,Good Company,I have been working at VMware full-time for more than 3 years,,"good company, good compensation, great campus, perks",layoffs politics mad senior management no growth sometimes,,4.0,4.0,3.0,3.0,4.0,2.0
Mon Feb 18 2019 11:46:50 GMT-0800 (Pacific Standard Time),,,Current Employee ,"Difficult place to work, with excellent pay and benefits.",I have been working at VMware full-time for more than a year,5,"There are many excellent workers here, with great attitudes. VMware is consistently on the leading edge of technology, and is always improving its products and has rightly earned the position of being the de facto standard in IT infrastructure virtualization. 

Pay and benefits are top notch.","The rate of organizational change is overwhelming. I'm on my fifth boss in less than three years. The one who hired me was simply excellent, and was one of the best bosses I ever had. Sadly, the last three were among the bottom 10% of all my bosses. 

My current boss does not respond to phone calls or emails, and no one is able to schedule meetings with her on a timely basis. When she does finally meet with us, she does 90% of the talking, most of which is merely a re-hash of what she knows about the situation but with no new insight or leadership provided. Essentially, she is all talk, and has developed a reputation among other executives as being uncooperative and just doing things on her own.

Finally, there is too much internal competition and politics where there should be teamwork and cooperation. People view it as a badge of honor if they do someone else's job, causing total chaos. There are routine ""land grabs"" by various directors and VPs, and of course, from people at Dell who seem to have nothing better to do. Sadly, this seems to be the norm at VMware.",VMware would benefit tremendously if there was more emphasis on multiplying the effectiveness of its employees.,2.0,3.0,1.0,2.0,5.0,2.0
Fri Feb 22 2019 12:10:04 GMT-0800 (Pacific Standard Time),,"Dallas, TX",Current Employee ,Global Program Manager,I have been working at VMware full-time for more than 5 years,,good pay good product great boss,Dell is not a positive influence and I fear for VMW's future.,Stand up to Dell,4.0,5.0,4.0,4.0,4.0,4.0
Mon Feb 04 2019 16:44:31 GMT-0800 (Pacific Standard Time), Senior Account Executive,"Los Angeles, CA",Current Employee ,Great place to work,I have been working at VMware full-time for more than 3 years,,Caring company that pays well,Very hard work and must be very committed to do well.,,5.0,,,,,
Sun Feb 03 2019 22:09:45 GMT-0800 (Pacific Standard Time), Senior Director,"Palo Alto, CA",Current Employee ,"Awesome company, leading edge thinkers, great culture",I have been working at VMware full-time for more than 8 years,,"breath of technology, great culture","steady company, still learning how to deliver a service",,5.0,4.0,5.0,4.0,5.0,4.0
Mon Feb 04 2019 14:04:02 GMT-0800 (Pacific Standard Time),,"Palo Alto, CA",Current Employee ,Awesome place to work,I have been working at VMware full-time for more than 5 years,,great tech. great people and solid leadership. Pat's a great CEO!,Could use a little more structure and mandates,,5.0,5.0,5.0,5.0,4.0,5.0
Mon Jan 28 2019 18:16:06 GMT-0800 (Pacific Standard Time), Director of Product Marketing,"Palo Alto, CA",Current Employee ,"Great company, still going great places",I have been working at VMware full-time for more than 3 years,1,"High growth for a 20+ year old company
Employees are valued
Opportunities to work on new exciting projects
Great people
Great work enviromnent (Palo Alto)","It's getting ""big"" as far as employee numbers
More ""hands in the pie"" and decisions take longer and you need some good negotiating power.",Cut back on meetings and senior leadership need to let people run free again to achieve great things FAST!,5.0,5.0,5.0,5.0,5.0,5.0
Fri Feb 08 2019 20:26:47 GMT-0800 (Pacific Standard Time), Senior Staff Engineer,"Palo Alto, CA",Current Employee ,Signs of decline everywhere,I have been working at VMware full-time for more than 3 years,5,Good product and work life balance,"Lot of new hires , insecure management, most teams seem to be interested in keeping their jobs rather than trying to do the right thing. The end result is often very poor quality product.",,2.0,3.0,2.0,3.0,4.0,1.0
Wed Feb 13 2019 22:06:30 GMT-0800 (Pacific Standard Time), MTS3,"Palo Alto, CA",Current Employee ,Great company with good work life balance,I have been working at VMware full-time for more than 3 years,,Great work life balance. Great campus/benefits,"Slow moving, less contribute to open source community",N/A,4.0,5.0,4.0,4.0,5.0,3.0
Wed Feb 06 2019 17:07:05 GMT-0800 (Pacific Standard Time),,,Current Employee ,Good to work,I have been working at VMware full-time,2,"Stress free, good benefits, good location","Not much growth, Work is not interesting",,4.0,,,,,
Mon Feb 04 2019 10:29:15 GMT-0800 (Pacific Standard Time),,"Austin, TX","Account Manager Latin America in Austin, TX",Nightmare,I worked at VMware for more than a year,5,"Innovative company, good training opportunities, dynamic pace","Toxic environment, LATAM team is “lead” by an unqualified manager and absentee and unethical director. Gossips, fights, name calling, lies, deceiving...mix it all. The manager lies as he breaths. No sense of professionalism whatsoever. Very little focus on the job and way too much time dealing with office drama that HR didn’t seem capable or interested in dealing with. The toxic environment is created mostly by an insecure manager who mostly employees friends and make of the workplace unhealthy, dysfunctional, and less than productive","Number one: hire and promote based on qualifications not friendship. That should be a must in any company, specially a company like VMWare (troubling)
Number two: ask for academic and professional qualification and experience. Shameful that “friends” hired can barely communicate on their own language and show little to no understand about professionalism in the workplace 
Create a culture of productivity and reward based on performance. My observation was that the managers friends would be given time off, flexible schedule, long vacations abroad (talking about 2 to 3 months) using the company time because the manager, while others were not allowed to even use sick time. Manager is extremely insecure and needs constant reassurance, which would not be as much a problem if he didn’t like to humiliate employees and gaslighting (he lies as he breaths) 
Get managers into mandatory ethical training, professionalism in the workplace, and talk about the importance of having any level of communication in English. Manager ONLy speaks with employees in Spanish and refuses to communicate in English with non Spanish speakers employees. 
Manager is unethical and abusive. HR is oblivious and inept
Realize that culture is toxic and money is being wasted with so much unnecessary unprofessional and toxic behaviors by manager .",2.0,2.0,2.0,1.0,4.0,1.0
Fri Feb 08 2019 07:56:46 GMT-0800 (Pacific Standard Time), Senior Member of Technical Staff,,Current Employee ,Not sure what this means.,I have been working at VMware full-time for more than 3 years,,"Good culture overall. But BU wise it can vary. 
Total compensation and pay are competitive. 
Beautiful campus.","Higher management in few BUs are not good.
They are bringing too many old school methods and spoiling life life ban lance of employees.","Concentrate more towards automation. That will ease out life of employees, bring innovation and also more importantly helps to increase the quality.
Being in software company everyone should be writing code be it developer or qe.",4.0,3.0,4.0,4.0,4.0,2.0
Wed Jan 23 2019 20:57:32 GMT-0800 (Pacific Standard Time), Strategic Sourcing Manager,"Austin, TX",Current Employee ,Great company,I have been working at VMware full-time for more than a year,,"Great team, culture and company",No cons at VMware currently,,5.0,5.0,5.0,4.0,4.0,5.0
Tue Feb 26 2019 22:04:38 GMT-0800 (Pacific Standard Time),,,Current Employee ,Only Few,I have been working at VMware full-time for more than 3 years,3,"Good benefits , Average Compensation .Work life balance .","Too much Political , Useless middle level managers insecure .",,1.0,,,,,
Thu Jan 17 2019 07:43:48 GMT-0800 (Pacific Standard Time), Client Executive,"Austin, TX",Current Employee ,"Great company, but changing rapidly- for the worse.",I have been working at VMware full-time for more than 8 years,2,"Too many to name. Benefits, culture although slowing changing (Thanks, Dell).",Hyper-focused on growth in emerging products. Tough for a longer sales cycle and quarterly commissions.,,5.0,3.0,5.0,4.0,4.0,4.0
Wed Jan 16 2019 06:41:42 GMT-0800 (Pacific Standard Time), Human Resources Source Employee Advisor,"Austin, TX",Current Employee ,"Great company, stagnant personal growth",I have been working at VMware full-time for more than 3 years,1," great CEO
- lives up to values 
- great benefits
- competitive pay 
- professional development funding available"," internal mobility is extremely difficult 
- new college grads may find their career become stagnant very quickly
- few professional growth opportunities available
- on the job growth dependent on manager",Take a chance on your internal employees to fill roles,5.0,3.0,5.0,2.0,5.0,4.0
