date,employee_title,location,employee_status,review_title,years_at_company,helpful,pros,cons,advice_to_mgmt,rating_overall,rating_balance,rating_culture,rating_career,rating_comp,rating_mgmt
Mon Sep 24 2018 06:08:15 GMT-0700 (Pacific Daylight Time), Director,"Santa Clara, CA",Current Employee ,Making a difference,I have been working at NVIDIA full-time for more than 8 years,2,"NVIDIA enables talented people to do their lifes work and make a difference in fields from Computer Graphics to Deep Learning. 

Fast paced culture means that ideas/products/focus are constantly evolving. 

Seeing the work that you do make a difference. NVIDIA technology is at the forefront in shaping the future of healthcare; driving innovation in cloud services; winning Oscars for special effects; revolutionary the fields of robotics & autonomous vehicles. All of these breakthroughs are driven by empowered individuals and/or small teams. 

Working in the enterprise team we get to work with talented and wonderful customers who are often at the forefront of changing workflows within their industries. Engaging with these individuals is what makes every day special.","Everyone is trying to be the best version of themselves - this means you have to be prepared to share and defend ideas; receive critical feedback, not platitudes; be proud of your work but never be satisfied. 

Time is short; you need to work at the speed of light and be prepared to change direction; drop good ideas in favor of great ones. 

New hires need to be self-starting - not being afraid to ask questions of leaders and peers.",Keep hiring the best people - regardless of roles or titles.,5.0,4.0,5.0,5.0,5.0,5.0
Sun Sep 23 2018 21:04:40 GMT-0700 (Pacific Daylight Time),,"Santa Clara, CA",Current Employee ,A Place to be Yourself,I have been working at NVIDIA full-time for more than a year,2,"You work for a visionary leader
You work for brilliant yet humble leaders
You work with teammates who are like family","Like any successful high growth companies, you commit your mindshare and time to the company

You have to set your own boundaries.",Give people true breaks. Encourage people to take vacation and do not distract them during that time.,5.0,3.0,5.0,5.0,4.0,5.0
Wed Sep 26 2018 13:28:27 GMT-0700 (Pacific Daylight Time),,"Santa Clara, CA",Current Employee ,"fast-paced, energetic workplace for self-starters",I have been working at NVIDIA full-time for less than a year,1,NVIDIA is a great place for self-starters who are passionate about their work. New hires can quickly have impact with their projects. Good food -- though it's not free.,"Things change at the speed of light, so doesn't work well for people who get attached to projects or can't pivot quickly. Office decor could be warmer/friendlier.",Require one on ones,5.0,3.0,4.0,4.0,4.0,3.0
Wed Sep 26 2018 15:47:09 GMT-0700 (Pacific Daylight Time), Director,"Santa Clara, CA",Current Employee ,Once in a Lifetime Career Experience,I have been working at NVIDIA full-time for less than a year,1,"It is a rare opportunity for someone to be a part of a company that is truly changing the world. Exciting doesn't begin to describe what an employee gets to be a part of. From my perspective, every employee counts and makes a difference. NVIDIA offers the opportunity to gain new experiences and move around into different roles. The salary and benefits package is better than many high-tech companies. While most employees work a lot of hours, the company is also flexible with time off or WFH when needed. Strategies and business direction is openly shared with employees, which is often not the case for a larger company.","The company moves ""at the speed of light,"" but at the same time, sometimes it takes too long to get things done. That can be frustrating. However, if one is persistent, you can keep things moving. The hours are long and the workload is demanding. That works for some people, but not others. It is something for a prospective employee to think about.","Keep up the good work, and be watchful for good employees that start to burn out, especially those that have made a large sum of money with stock. There is a lot of really phenomenal talent at NVIDIA. It would be sad to lose it. It is a privilege to work at NVIDIA. As well as it is a privilege for NVIDIA to attract top talent.",5.0,4.0,5.0,5.0,4.0,5.0
Sat Oct 13 2018 07:26:16 GMT-0700 (Pacific Daylight Time),,"Santa Clara, CA",Former Employee ,Tools development engineer,I worked at NVIDIA full-time for less than a year,,"Good package
Work-life balance
Good company to become technically strong",I do not remember any,,4.0,4.0,5.0,3.0,4.0,2.0
Tue Sep 25 2018 21:03:07 GMT-0700 (Pacific Daylight Time), Engineering Program Manager,"Santa Clara, CA",Current Employee ,"World Changing Compute Power, Amazing Culture",I have been working at NVIDIA full-time for more than 5 years,1,"As an Nvidian, I am part of the team that is bringing world changing computing technology to the market. The work is challenging and rewarding, with plenty of opportunity for growth, an amazing team. Business is conducted with utmost integrity. It's a great place to work, I highly recommend it!",A fast paced environment can make it challenging to get acquainted.,,5.0,5.0,5.0,5.0,5.0,5.0
Tue Sep 25 2018 12:11:29 GMT-0700 (Pacific Daylight Time),,"Santa Clara, CA",Current Employee ,Best company to work for,I have been working at NVIDIA full-time for less than a year,,"Flexibility to work from anywhere, lots of team work, you get to work with some of the best professionals out there, flexibility to move to different teams, NSU's for all full time employees, great benefits",the company still feels like a start up so the workload is high compare to any other company,be considerate of work life balance,5.0,3.0,5.0,5.0,5.0,4.0
Thu Sep 20 2018 18:30:18 GMT-0700 (Pacific Daylight Time),,"Santa Clara, CA",Current Employee ,Senior Director,I have been working at NVIDIA full-time for more than 10 years,1,NVIDIA is an incredibly innovative company with an environment that fosters creativity and people wanting to do their best.,"With hard work comes little downtime. That said, everyone is here because they love working here.",,5.0,4.0,5.0,5.0,5.0,5.0
Thu Oct 04 2018 10:18:42 GMT-0700 (Pacific Daylight Time),,"Santa Clara, CA",Current Employee ,Incredible company with a couple growing pains,I have been working at NVIDIA full-time for more than 3 years,1,You work with really smart people. Your colleagues are dedicated and likely have been at the company for an extended period of time. The medical benefits are insanely good. The products are innovative. And there's a clear vision for the company.,"Unlimited PTO makes it hard to feel entitled to actually taking the time off. Work life balance can be tough at times. No proper onsite gym with showers. Professional growth can be slow. Cafe food subpar. In sum, trying to act like a big company and start-up at the same time.","Recently, the corporate culture feels lacking. No real charitable opportunities, celebrations or team camaraderie.",4.0,3.0,4.0,2.0,5.0,5.0
Tue Sep 18 2018 22:48:41 GMT-0700 (Pacific Daylight Time), Recruiter,"Santa Clara, CA",Current Employee ,Great Ambition,I have been working at NVIDIA full-time for more than a year,1,"NVIDIA is diving into the most advanced technologies and partnering up with amazing companies to deliver a revolutionary product across multiple industries.

Fast pace and hardly a dull moment

Great flexibility 

Feels like I am making meaningful contributions","Teams need to grow to keep up with demands

We could use a gym",,5.0,5.0,5.0,5.0,4.0,5.0
Fri Sep 21 2018 22:57:02 GMT-0700 (Pacific Daylight Time), Senior DevOps Engineer,"Santa Clara, CA",Current Employee ,Great place to work,I have been working at NVIDIA full-time for less than a year,,"Team attitude pervades the company. ""Let's get this done together!"" Clear thinking in many decisions, whether hiring, designing a product, or building a new building. Great products. Good benefits package.",Technical competition - don't be lazy,,5.0,5.0,5.0,5.0,5.0,5.0
Fri Sep 21 2018 12:45:15 GMT-0700 (Pacific Daylight Time),,"Santa Clara, CA",Current Employee ,Awesome Company to Work For,I have been working at NVIDIA full-time for more than a year,,"Incredible company culture, technology that is going to impact the world, and wonderful people.",No cons to share at this time,,5.0,5.0,5.0,5.0,5.0,5.0
Thu Sep 20 2018 14:46:11 GMT-0700 (Pacific Daylight Time),,"Santa Clara, CA",Current Employee ,Opportunity for impact in a growing company,I have been working at NVIDIA full-time for less than a year,,"Fast growing company working to scale as it grows to a big company. Opportunity to have significant impact in the long-term growth of the company.
CEO thinks long term. Great compensation and benefits - amazing ESPP!
Leading edge technology that is changing the world.",Highly matrixed organization - will take time to learn and figure out.,Reinforce the message to challenge the status quo and be our best.,5.0,5.0,5.0,5.0,5.0,5.0
Thu Sep 20 2018 19:36:38 GMT-0700 (Pacific Daylight Time), Director,"Santa Clara, CA",Current Employee ,Director,I have been working at NVIDIA full-time for more than 10 years,,The best place I've worked by far. The company cares for its employees and is evident in everything they offer.,"There is a lot of work to do, but only because we are entering into new markets and exploring new technologies every day. Very exciting to be a part of this.",Continue to put employees first. They will return the favor.,5.0,5.0,5.0,5.0,5.0,5.0
Wed Sep 19 2018 09:51:26 GMT-0700 (Pacific Daylight Time),,"Santa Clara, CA",Current Employee ,Programs Manager,I have been working at NVIDIA full-time for more than a year,," Good ESPP program (2 year look back)
- Great Parental Leave Program
- Nice people and good career growth
- Free dinners", no free lunch and the parking situation could be improved,,5.0,4.0,5.0,4.0,5.0,4.0
Wed Sep 19 2018 12:35:59 GMT-0700 (Pacific Daylight Time),,"Santa Clara, CA",Current Employee ,NVIDIA is #1,I have been working at NVIDIA full-time for more than a year,,NVIDIA fosters such a phenomenal culture - starting from management (leadership) down to my peers. Every single person has a major impact on what NVIDIA stands for and has incredible pride and integrity. I wake up every morning knowing that I am heading to work with people that I call friends. This includes my manager and all of leadership. There is a ton of support and encouragement! I have been at NVIDIA for 1 year and 6 months. Work life balance is a huge topic and enforced 100%. It's been an amazing journey so far and I am so excited to continue my journey here.,The cafe can have better options for food.,,5.0,5.0,5.0,5.0,5.0,5.0
Wed Sep 19 2018 16:28:13 GMT-0700 (Pacific Daylight Time),,"Santa Clara, CA",Current Employee ,Human Resources,I have been working at NVIDIA full-time for more than a year,,"good pay, great people, wonderful benefits, humble flat organization",can't really think of any,,5.0,4.0,5.0,4.0,5.0,4.0
Tue Sep 18 2018 11:31:00 GMT-0700 (Pacific Daylight Time),,"San Jose, CA",Current Employee ,Human Resources,I have been working at NVIDIA full-time,,"* Company driven with speed and agility
* Focused on outcomes and less ambiguity
* Culture to Succeed
* Employees have the pride in what they do",* Systems and Tool support could be improvised,Great Leadership and keep up the awesome work. Encourage the new bees to challenge the status quo.,5.0,5.0,5.0,5.0,5.0,5.0
Mon Sep 17 2018 17:48:48 GMT-0700 (Pacific Daylight Time),,"Santa Clarita, CA","Software Development Engineer Intern in Santa Clarita, CA","Good Company, Good Team",I worked at NVIDIA for less than a year,,"Good place to work.
Good work life balance.",Dont like the working environment of new building.,,5.0,5.0,5.0,5.0,5.0,5.0
Tue Sep 25 2018 19:47:34 GMT-0700 (Pacific Daylight Time),,"Santa Clara, CA",Current Employee ,Good Career Move,I have been working at NVIDIA full-time for more than 10 years,1,Lots of opportunities to make a difference. Flexible processes.,Hours can be long as we strive for Speed of Light.,,4.0,3.0,5.0,3.0,5.0,3.0
Sun Sep 09 2018 19:35:45 GMT-0700 (Pacific Daylight Time), Manager,"Santa Clara, CA",Current Employee ,"Exceptional people, dynamic work environment",I have been working at NVIDIA full-time for more than a year,1,You'll be surrounded with an international group of exceptional folks. The work is challenging and dynamic. The amount of work is interesting and significant and will take a more than 40 hours/week. Management is aware of the workload and encourages employees to find the appropriate work/life balance.,"While Nvidia is a large company, it is competing in a very dynamic environment. Expect for direction and requirements to change to meet market demands. You can view this as either a pro or a con. There is a deep Nvidia culture, context and vocbulary, expect on-boarding to be challenging.",,5.0,4.0,5.0,5.0,5.0,5.0
Tue Sep 11 2018 11:09:09 GMT-0700 (Pacific Daylight Time),,"Hillsboro, OR",Current Employee ,Wonderful place to do your life's work - still great after 12 years,I have been working at NVIDIA full-time for more than 10 years,,"Working with bright, motivated people on challenging, meaningful projects.
Phenomenal benefits - very family oriented.
Excellent work environment; flexible work day, very supportive team and management.
Nimble, responsive management helps keeps projects and roadmaps relevant. 
Working for a technology company that has broken out [from the flattening] Moore's Law.",Not wanting to work anywhere else.,"Keep up the good work.
Keep motivating employees with great work, great benefits and a our focused vision.",5.0,4.0,5.0,5.0,5.0,5.0
Fri Sep 07 2018 16:44:02 GMT-0700 (Pacific Daylight Time),,"Santa Clara, CA",Current Employee ,A great company with a great future,I have been working at NVIDIA full-time for more than 3 years,1,"visionary CEO with an altruistic and global view
a product that people want and need
open culture, everything shared with employees
non hierarchical businesses - access to everyone
moves fast fast fast","sometimes more frantic than just 'lean'
work/life balance is an issue
old processes that need to be scrapped and replaced with a more modern approach",keep doing what you're doing - excited to be on the journey with you!,5.0,3.0,5.0,5.0,4.0,5.0
Fri Sep 07 2018 16:42:09 GMT-0700 (Pacific Daylight Time),,"Santa Clara, CA",Current Employee ,Accomplish BIG things and grow your career!,I have been working at NVIDIA full-time,,"Inspirational leader with passion and a vision! 
Opportunity to build and pioneer!
Employees are treated like family!","Cafes are okay, but could be a lot better.",,5.0,3.0,5.0,5.0,4.0,5.0
Thu Sep 06 2018 12:03:42 GMT-0700 (Pacific Daylight Time),,"Santa Clara, CA",Current Employee ,Great Company!,I have been working at NVIDIA full-time for more than a year,,"I've been working at NVIDIA for about 18 months now. I have had more exposure to senior management that any other place that I have worked. Also, the benefits are amazing - the CEO clearly cares his employees.",NVIDIA is a great place!,,5.0,5.0,5.0,5.0,5.0,5.0
Mon Aug 27 2018 20:50:39 GMT-0700 (Pacific Daylight Time), Senior Manager,"Santa Clara, CA",Current Employee ,"Great engineering culture, cutting edge tech projects & minor downsides.",I have been working at NVIDIA full-time for more than 8 years,1," Some of the brightest engineering minds in the industry. I have never seen that many passionate & dedicated to their job people together in any other place.
- Jensen is both visionary and very hands-on. Answers emails 24/7. Always challenges you to do better. 
- Upper management overall (SVPs, VPs) is also very involved and attentive to the details. World class management team.
- Pay-for-performance culture. Decent compensation level is usually achievable after a several years in the company.
- Friendly, casual work environment."," Santa Clara campus got a bit overcrowded. Too much noise, not enough personal space. The new building looks fancy but is not that convenient to work in.
- On the entry & medium management level not everybody wants to take extra effort to see ""a big picture"" and plan ahead. That leads to a lot of roadblocks that could have been avoided and priority changes.
- Pay is a bit worse than the top competition. Still, the culture is so great that you do not want to go elsewhere.",,5.0,5.0,5.0,5.0,4.0,5.0
Thu Aug 30 2018 14:50:22 GMT-0700 (Pacific Daylight Time), Software Engineer,"Santa Clara, CA",Current Employee ,Great place to work,I have been working at NVIDIA full-time for more than a year,,Great opportunities Good environment Great people,There are no Cons to working at Nvidia,,5.0,4.0,5.0,5.0,5.0,5.0
Mon Aug 20 2018 13:39:08 GMT-0700 (Pacific Daylight Time),,"San Jose, CA","Software Engineer in San Jose, CA",Great Benefits + Good People,I worked at NVIDIA for more than 8 years,1,The managers and people at NVIDIA are all nice and respectful. The 5 year plan is good. And the pay is well.,The amount of work you haft to do to get paid is absurd.,Pay more for your employes,5.0,3.0,4.0,5.0,5.0,4.0
Fri Aug 03 2018 10:56:11 GMT-0700 (Pacific Daylight Time),,"Santa Clara, CA",Current Employee ,"Great people, culture and mission",I have been working at NVIDIA full-time for less than a year,2,"Colleagues are the best and brightest in the industry and welcome new employees to the ""family"" at NVIDIA in an atmosphere that is friendly, down to Earth and encourages people to be themselves. People are encouraged to be self-directed and given a lot of latitude to figure things out and to strive for great work or even to try new things that push boundaries. No organizational chart hierarchy headaches because this place empowers individuals to make it happen. Overall, this creates a great work culture, but there's something extra, too, that gives it this notion of a shared purpose, one mind and mission sort of environment, in which people feel compelled to do great work and are in it together. The shared mission for where this company stands in the AI market only adds to the shared sense of excitement for the vision, enthusiasm and purpose.","Having little direction may be shocking or confusing for some at first, but it's a good thing for those who understand the mission and their purpose.",Keep keeping it real. Don't let a jump in employee numbers change the great culture here.,5.0,5.0,5.0,5.0,5.0,5.0
Wed Aug 01 2018 00:42:14 GMT-0700 (Pacific Daylight Time), Senior Architect,"Santa Clara, CA",Current Employee ,Not good for senior engineers,I have been working at NVIDIA full-time for more than 3 years,6,Cool projects to work on. Generally people are very talented and teams are inclusive. You can easily reach out to other teams and get help.,"Very hard to grow career, raise level and get advance in pay and stock. Can literally take decades. Working hard and being a top contributor usually result in 3% salary increase and a stock grant at 20% of salary (vested over 4 years). Makes you feel it is really not worth it.","Invest in people, not in new buildings",4.0,4.0,5.0,1.0,3.0,2.0
Wed Aug 01 2018 21:59:47 GMT-0700 (Pacific Daylight Time),,"Santa Clara, CA",Current Employee ,A Bracing Ride,I have been working at NVIDIA full-time for more than 8 years,,Incredible vision inspired by one of America's great CEOs. Tremendous ambition that aims steadily higher. Politics-free environment.,I haven't found any yet.,Retain focus and discipline amid growing distractions.,5.0,5.0,5.0,5.0,5.0,5.0
Wed Aug 01 2018 22:06:27 GMT-0700 (Pacific Daylight Time), Senior Content Writer,"Santa Clara, CA",Current Employee ,Company overview,I have been working at NVIDIA full-time for more than 3 years,,The chance to work with brilliant people doing ground-breaking work that will touch and improve lives for years to come. Getting to learn something new every day.,"It's in Santa Clara, and not near anything.","Celebrate anniversaries with a week of enforced vacation, or a bonus of some sort.",5.0,4.0,5.0,4.0,5.0,5.0
Wed Aug 01 2018 22:27:38 GMT-0700 (Pacific Daylight Time),,"Santa Clara, CA",Current Employee ,The Culture!,I have been working at NVIDIA full-time,,"The best part about NVIDIA is the company culture. We're one huge team. This means we're all in it together and working as one big family/team to move the company forward. 
Employees here come first and we're well supported in order to do our life's work.",Can't think of anything right now.,,5.0,5.0,5.0,5.0,5.0,5.0
Thu Aug 02 2018 10:42:29 GMT-0700 (Pacific Daylight Time)," Director, PR","Santa Clara, CA",Current Employee ,PR Director,I have been working at NVIDIA full-time for more than a year,,"Fun to work at a company that's right in the middle of exciting changes happening due to our technology. Strong, supportive team culture. Co-workers care about one another.",Pace can sometimes be hard to keep up with. There's boundless energy here! People who work at NVIDIA need to be disciplined enough to make time for themselves to recharge when needed.,None at this time.,5.0,4.0,5.0,5.0,5.0,4.0
Thu Aug 02 2018 14:41:46 GMT-0700 (Pacific Daylight Time),,"Santa Clara, CA",Current Employee ,Great company,I have been working at NVIDIA full-time for more than 5 years,,"The company is growing into lots of vital areas: self-driving cars, VR, graphics, gaming, medical imaging and many more. This helps make it a stimulating and meaningful environment. I work on a great team, with little politics. The company is pretty flat overall, with little bureaucracy.",Can have long hours (balanced by flex-time and work from home policies),Keep swinging for home runs.,5.0,5.0,5.0,5.0,5.0,5.0
Thu Aug 16 2018 20:35:24 GMT-0700 (Pacific Daylight Time),,"Santa Clara, CA",Current Employee ,good first year,I have been working at NVIDIA full-time,,"Strong culture, good benefits, motivated leadership","Growing pains, lots of pressure on some teams","If you want intellectual honesty, don't scare people so much",4.0,3.0,4.0,4.0,4.0,5.0
Fri Aug 10 2018 16:22:48 GMT-0700 (Pacific Daylight Time), Senior Engineer,"Santa Clara, CA",Former Employee ,Terrible,I worked at NVIDIA full-time for more than 3 years,5,Stock does well thanks to deep learning,"This is an extremely aggressive work environment. Most people leave in about two years. The ones that stick around are the ones that thrive in this hostile, aggressive work environment. I've seen people get yelled and screamed at publicly. They also do not value diversity no matter what the company tag line is and it's a very unhealthy workplace if you are a minority. It is also worth pointing out that this company (despite the stock doing very well) has had one good idea that it has been capitalizing on for years and has failed miserably at everything else it tried pivoting to...",Beyond redemption,2.0,1.0,1.0,2.0,1.0,1.0
Mon Jul 16 2018 06:45:42 GMT-0700 (Pacific Daylight Time),,"Santa Clara, CA",Current Employee ,"Winning Company - Great Company, Culture and People",I have been working at NVIDIA full-time for more than 3 years,4,"Endless opportunities to grow, excel and innovate
A company culture of employee first
A driven CEO who is committed to driving NVIDIA to excellence
Everyday you have the opportunity to work with really smart people on challenging and cutting edge technology and projects
Work at speed of light 
Flexible work environment
Winning Company",Some old legacy processes still in place that make it hard to get your job done,Keep doing what you are doing,5.0,4.0,5.0,5.0,5.0,5.0
Sun Aug 12 2018 10:47:23 GMT-0700 (Pacific Daylight Time), Senior ASIC Design Engineer,"Santa Clara, CA",Current Employee ,great company,I have been working at NVIDIA full-time for more than 5 years,,"great minds
adapts fast
lower politics compared to other companies of this size.
open culture",work life balance may take a toll,"your best strength are the minds , keep hiring great people and retaining the good ones.",4.0,3.0,5.0,5.0,4.0,4.0
Tue Jul 31 2018 17:03:34 GMT-0700 (Pacific Daylight Time),,"Santa Clara, CA",Current Employee ,Infrastructure Manager in IPP,I have been working at NVIDIA full-time for more than 3 years,5,"Decent pay.
Stock growth.
ESPP 24 months period.
Next Generation products on DP, AV, AI etc","1) IPP is bottom level group no one would give a dime.
2) Internal transfers are difficult, old management have HW company mentality, new management being hired are not dynamic , have poor people management skills and it is seen in all teams IPP, NGN, AV, DP etc
3) Almost every director, senior manager and manager in IPP play cheap politics and have favorites.
4) Software engineers coming from top companies like google, FB, Salesforce etc will have hard time to adjust the culture with no perks like GYM, Food, Hackathons, employee training's, bonus etc.","1) Please hire people who are innovative, dynamic, smart etc. Good pay can attract good talent.
 2) IPP needs a good leader who works in Santa Clara.
3) Attracting talent to santa clara is hard since no good schools for kids and people have to stay in sarotoga, cupertino, las gatos which are exorbitant, pay should be better and yearly good bonus and stocks would help.
4) Provide employee training's, manager were told collect training requirement then no word after that. 
5) Provide mandatory people management skills training for all the manager in Nvidia.",3.0,3.0,1.0,1.0,3.0,1.0
Wed Jul 18 2018 18:25:44 GMT-0700 (Pacific Daylight Time), Software Engineer,"Santa Clara, CA",Current Employee ,Software Engineer,I have been working at NVIDIA full-time for more than a year,,"Nvidia is a company filled with driven, passionate and incredibly intelligent people who want to solve cool problems.",Work life balance can get a bit wearing,,5.0,3.0,4.0,4.0,4.0,3.0
