date,employee_title,location,employee_status,review_title,years_at_company,helpful,pros,cons,advice_to_mgmt,rating_overall,rating_balance,rating_culture,rating_career,rating_comp,rating_mgmt
Sun Sep 17 2017 13:27:14 GMT-0700 (Pacific Daylight Time), Systems Engineer,"Santa Clara, CA",Current Employee ,In general very nice place to work,I have been working at NVIDIA full-time for more than 5 years,,"pretty smart people to work with 
senior management esp in product teams are very technical 
very friendly and open environment",sometimes can be very overloaded esp before product launch,,4.0,4.0,5.0,4.0,4.0,4.0
Fri Aug 11 2017 15:47:13 GMT-0700 (Pacific Daylight Time), Senior Platform Engineer,"Santa Clara, CA",Current Employee ,"Strong Vision, Great Workplace, Filled with Integrity",I have been working at NVIDIA full-time for more than a year,2,"Lots of room for growth.
General feeling of trust in fellow employees.
A good office vibe (not too corporate, not too much like a startup).
Clear vision and execution towards that vision.
Awesome products that are really cool for consumers, enterprise, and scientists.
Great pay and benefits.","There is a lot to do, it is easy to over commit.
It's not always clear who is in charge of what.",,5.0,3.0,5.0,5.0,5.0,5.0
Thu Sep 14 2017 21:33:26 GMT-0700 (Pacific Daylight Time), Verification Design Engineer,"Santa Clara, CA",Current Employee ,Micromanaging Nightmare,I have been working at NVIDIA full-time for more than a year,11,"ESPP has strong growth
What doesn't kill you makes you stronger",Nvidia is my 3rd job and by far the worst. Every week I must account for very hour of my time and tell them what test I debugged for 0.2 days.,Advice will help. You all must be replaced.,1.0,1.0,1.0,1.0,4.0,1.0
Wed Aug 23 2017 05:18:12 GMT-0700 (Pacific Daylight Time), Hardware Engineer,"Santa Clara, CA",Current Employee ,Good momentum,I have been working at NVIDIA full-time for more than a year,2,Good momentum. Everybody is excited and looking forward to the future. The company is expanding. Working environment is good. Cafe menu improves since last year and food quality is going up. Benefits are okay.,Benefits could be better. 401k could be more generous. Break room sucks - I'm surprised that there is no espresso machine in my building! No free snacks or soda drinks. No onsite gyms.,"Yes Nvidia stock is climbing which makes the ESPP program looks attractive and it seems a lot of juice for the employees. However, there are so many items that Nvidia still acts like years ago like the Cons I listed. Those items could make employees feel less satisfied. Those items make Nvidia not that generous to its employees.",4.0,2.0,3.0,2.0,2.0,2.0
Tue Aug 01 2017 06:39:34 GMT-0700 (Pacific Daylight Time), Senior Director,"Santa Clara, CA",Current Employee ,Biggest startup in the valley,I have been working at NVIDIA full-time for more than 8 years,,"smart people, move quick, everyday is a new challenge, incredible leadership",So much to do so little time,,5.0,4.0,5.0,5.0,5.0,5.0
Tue Jul 18 2017 19:38:08 GMT-0700 (Pacific Daylight Time), Senior ASIC Design Engineer,"Beaverton, OR",Current Employee ,One of the best places to start.,I have been working at NVIDIA full-time for more than 5 years,4,"1. Jensen (CEO) is very involved.
2. Company dares to take risks and kicks new doors open.
3. Great commitment to projects.
4. Some of the smartest people around. 
5. Everyone is helpful. 
6. Good benefits. 
7. Senior management is accessible.
8. Opportunity to move between teams. 
9. Short on staff, so you can get entrusted with responsibility someone else in some other company could take years to get. Great for learning.","1. If you want to do challenging work then work life balance can be bad.
2. No performance stock options. 
3. The management structure is confusing.
4. While you can learn a lot, no advice on career path from management.",Hire more people. Add stock option as part of compensation.,5.0,2.0,5.0,5.0,4.0,5.0
Wed Aug 09 2017 13:34:43 GMT-0700 (Pacific Daylight Time), Senior Product Manager,"Santa Clara, CA",Former Employee ,Sr. Product Manager,I worked at NVIDIA full-time for less than a year,,innovation is the backbone of the company and the camaraderie of teams is a huge bonus when it comes to team collaboration,no time to improve quality because the importance was to stress: move on to the next project and forget about the last one,Evaluation and self reflection of performance on cyclical projects can be a learning tool to make the company overall more efficient,4.0,4.0,5.0,4.0,4.0,3.0
Wed Jul 19 2017 22:52:07 GMT-0700 (Pacific Daylight Time), Senior Software Engineer,"Redmond, WA",Current Employee ,Amazing work culture,I have been working at NVIDIA full-time for less than a year,,"working with group of really smart and passionate people
good work life balance",lack of software infrastructure and tools,Improve software infrastructure and tools,5.0,5.0,5.0,4.0,4.0,4.0
Mon Jun 26 2017 07:56:46 GMT-0700 (Pacific Daylight Time), Senior Research Scientist,"Redmond, WA",Current Employee ,Really enjoying my time at NVIDIA,I have been working at NVIDIA full-time for more than 3 years,4,Everyone is incredibly talented but also humble and willing to join forces,Open spaces are a terrible idea and they are impacting our productivity,Invest in proper working spaces. Open spaces are destroying productivity,5.0,4.0,5.0,3.0,4.0,5.0
Sun Aug 06 2017 18:04:10 GMT-0700 (Pacific Daylight Time), Technical Writer,"Santa Clara, CA",Former Employee ,Micro-managed Nightmare,I worked at NVIDIA full-time for less than a year,8,"Nvidia is a large company, so your experience may be pleasant or nightmarish, depending on the department you work in. I had an insecure, micro-managing boss, so my experience was horrific. If you value your sanity, avoid the technical writing department for the BSP (Board Support Package).",Micro-manager who would sabotage projects and then swoop in to save the day. Received no assistance from HR. Nvidia is a candidate for the worst job I've ever had.,,1.0,,,,,
Wed Jun 21 2017 11:49:37 GMT-0700 (Pacific Daylight Time), Senior Research Scientist,"Westford, MA",Current Employee ,A Very Fulfilling Place to Work,I have been working at NVIDIA full-time for less than a year,2,"NVIDIA is a great place to work, starting with the culture. Employees have a very positive and cheerful attitude because the company retains its startup flavor of being on a mission, and it values its people. The goodness comes from the top, with Jensen's unique brand of encouragement, humor, and a bit of fear mongering. Long-term vision based on principles is celebrated, and hard work is rewarded. Everything we do is cutting-edge, so the work is technically satisfying as well as being relevant. In my particular case, NVIDIA lets me work remotely, which few companies these days do. One other important aspect of NVIDIA worth mentioning is the openness toward respectful disagreement at every level. There is a strong belief that confronting challenges early is always better than hiding them, and all levels of management welcome hearing about issues from anyone. What more could you want?","The only thing I don't like very much is the vacation policy. There is no fixed schedule. Vacation time is agreed upon between employees and their managers, which puts employees in the uncomfortable position of worrying that they are asking for too much, especially relative to their peers.","Do your best to keep the start-up culture even as the company grows. Sacrifice managers before sacrificing the culture! I worked for many years at IBM, so I know what can be lost.",5.0,4.0,5.0,5.0,5.0,5.0
Wed Jun 21 2017 15:33:47 GMT-0700 (Pacific Daylight Time), Senior Product Manager,"Santa Clara, CA",Current Employee ,Excellence,I have been working at NVIDIA full-time for more than a year,1," Fast-paced culture 
- Confrontational technical mindset
- Intellectual honesty",Cannot think of any at this time.,,5.0,1.0,5.0,5.0,5.0,5.0
Fri Jun 23 2017 15:18:11 GMT-0700 (Pacific Daylight Time), Operations Research Analyst,"Santa Clara, CA",Current Employee ,Operations Research Analyst - BSA,I have been working at NVIDIA full-time for less than a year,,"Work Life balance, Benefits, Open Culture, Growth, Comps","No/low rsus at certain job level, MAC is not supported product at work.",,5.0,4.0,5.0,5.0,5.0,
Thu Jun 22 2017 23:09:44 GMT-0700 (Pacific Daylight Time), Software Engineer,"Santa Clara, CA",Current Employee ,Good growing and improving company,I have been working at NVIDIA full-time for more than 3 years,3,"Relatively high base pay
Good benefits
Job security","Management can be poorly structured or organized
Occasional politics
Software could be done better","Aim for teams to work together better and towards the final product
Avoid and reduce any inefficiencies due to politics",4.0,3.0,3.0,4.0,3.0,3.0
Tue Jun 06 2017 15:54:15 GMT-0700 (Pacific Daylight Time), Verification Engineer,"Santa Clara, CA",Current Employee ,Awesome work culture!,I have been working at NVIDIA full-time for more than 3 years,2,"Super work life balance (at least in my team). 
Realistic deadlines
Decent benefits
Clear on short and long term goals","Nothing really. 
Cafe is not that great if u care about it.
No additional benefits other than salary, health, espp and 401k.","Second and third level managers should interact with individual contributors for the sake of rapport. 
Also I don't like the company meetings - Lot of repetition of the same statements again and again. There is a lot of awesome content that can be talked about, but they tend to show off only the highlights over and over. It gets booooring",5.0,5.0,5.0,5.0,4.0,5.0
Tue Jun 06 2017 17:46:54 GMT-0700 (Pacific Daylight Time), Design Manager,"Santa Clara, CA",Current Employee ,Amazing Company with Outstanding Future,I have been working at NVIDIA full-time for more than 10 years,,"World class people, technology, strategies and products.",Being a world leader in multiple fields means that there are many competitors.,,5.0,5.0,5.0,5.0,5.0,5.0
Sun Jun 11 2017 08:25:27 GMT-0700 (Pacific Daylight Time), Business Systems Analyst,"Santa Clara, CA",Current Employee ,Innovative company,I have been working at NVIDIA full-time for less than a year,1,"Cutting edge technology company 
CEO very involved 
Amazing employee benefits 
Stock price increasing 
RSUs vesting is competitive 
Great intern program 
Events draw positive company exposure","CEO very involved 
Work life balance does always compute 
Cafe menu is good but food / kitchen may need attention due to many getting sick after lunch",,4.0,3.0,2.0,2.0,4.0,3.0
Sun May 28 2017 13:54:23 GMT-0700 (Pacific Daylight Time),,"Santa Clara, CA","Hardware Engineer in Santa Clara, CA",Big Company that thinks it is a startup,I have been working at NVIDIA,,smart people everywhere! Opportunities to change roles with in the company. Founder still running the company (this may be a con as well) Pretty flexible about telecommuting.,"plans change very fast. If you are the kind of person who doesn't like change, this is not the place for you. Chips are cancelled and changed all the time. Workload can be very high in crunch times","Keep the culture of very capable people at all levels, it's better to need more people than it is to have people who bring the rest down.",5.0,3.0,5.0,4.0,5.0,4.0
Sat May 20 2017 00:48:49 GMT-0700 (Pacific Daylight Time),,"Santa Clara, CA","Systems Software Inter in Santa Clara, CA",Experience of Intern,I have been working at NVIDIA,2,"Unique technology. You get to know a lot about Deep learning, AI and other new technologies. Great benefits and compensation.",It's hard to get the gist of the structure of the organization. Work ambiance needs improvement. Felt like did not have good support initially to strengthen by basics.,"Improve the on-boarding process and training to ramp employees up even faster, by providing better documentation and references.",5.0,5.0,5.0,5.0,5.0,5.0
Thu Jun 01 2017 12:48:37 GMT-0700 (Pacific Daylight Time), Software Engineer,"Santa Clara, CA",Current Employee ,Software Engineer Tools and Infra,I have been working at NVIDIA full-time for more than a year,4,Stock go high. HW team is heading in industry(Talent people here). benefits is getting better as their stock prices goes up.,Old Culture. Old people. No Free Lunch. SW team's level is below average. (Isn't so much talent here).,,3.0,2.0,2.0,3.0,2.0,1.0
Thu Jun 22 2017 11:10:36 GMT-0700 (Pacific Daylight Time), Hardware Engineer,"Santa Clara, CA",Current Employee ,Pay below market,I have been working at NVIDIA full-time for more than 5 years,7,Nice work environment. The cutting edge technology. Play a very important role for the future. Nothing else I can mention....,"Lower pay, no promotion for a really really long time. I had work for nvidia for many years but still not get promot or any RSU.",Treat older employee better!,1.0,1.0,1.0,2.0,1.0,1.0
Thu May 11 2017 01:16:37 GMT-0700 (Pacific Daylight Time),,"Santa Clara, CA","Software Engineer in Santa Clara, CA",Software Engineer,I have been working at NVIDIA for more than 8 years,2,"Amazing people to work with
Great benefits
Cutting Edge AI technology and that actually matters
One of the highest base pay and equity package
Inspiring CEO
Stock keeps going up
New building will be done soon and looks fantastic","Food could be better
Hard to find parking on your own and must resort to free valet service they offer
No real negative of the many years of been here.",Keep up the great work,5.0,5.0,5.0,5.0,5.0,5.0
Fri May 12 2017 09:46:13 GMT-0700 (Pacific Daylight Time), Senior Product Manager,"Santa Clara, CA",Current Employee ,I wanted to share my great experience working at NVIDIA for anyone considering joining.,I have been working at NVIDIA full-time for more than 5 years,1,"First off, not every experience I have while working here has been great, but there are so many reasons that I love this company and the people it attracts, it outweighs any negatives . For reference I have worked here for 6 years.
- We are a data based company and a very intellectually honest company. If we fail, we fail together, but we don't hind mistakes or make excuses. We learn why we made the mistake and we adjust.
- Down to earth people. During the development of a product, I had no issues getting our engineering SVP in a room to help make decisions and make the product a success.
- We have great leaders. 
- We are investing in productivity, and infrastructure to help us innovate. IT has not always been good and is not great yet, but is getting better so quickly. And we are building the most beautiful new HQ - Endeavor.
- Great ESPP
- Onsite perks are getting really good.
- Healthcare access is a priority 
- Parental leave is great
- Work-life balance is a priority
- We only hire great workers and for the most part human beings... :)"," We are growing very fast and it is challenging to fit everyone in from a facilities perspective. Meeting space is tight, but we have invested in meeting pods to help.
- It is hard to think of others that I didn't list above"," Improve the on-boarding process and training to ramp employees up even faster
- Continue listening to employee feedback. I love that I can see company changes based on our responses in out company reviews.",5.0,5.0,5.0,5.0,4.0,4.0
Fri May 12 2017 10:10:50 GMT-0700 (Pacific Daylight Time), Senior Engineer,"Redmond, WA",Current Employee ,Excellent Company to work for,I have been working at NVIDIA full-time for more than a year,1,"Non-adversarial culture, helpful people who believe in products and aren't encouraged to succeed individually as much as a team

Smart and savvy leadership from the top

Work/life balance is the best I've ever seen, although it varies among teams

Perks are above average and are logically getting better with company growth

No ceiling, tons of potential, more down-to-earth feel, especially at satellite offices","New to industries other than GPUs and SoCs, so slow starts there and other bets that haven't quite paid off yet

Lack of structure can be frustrating for some folks, eg. rewards system

Career growth can be slow and questionable, very flat organizationally","Keep investing in people and they'll always want to work for you

More profit-sharing",5.0,4.0,5.0,4.0,4.0,4.0
Tue May 09 2017 13:40:17 GMT-0700 (Pacific Daylight Time), Senior Software Engineer,"Santa Clara, CA",Current Employee ,"Great for HW development, subpar for SW development",I have been working at NVIDIA full-time for more than a year,8,"+ Unique technology
+ Exposure to AI and new technologies
+ Nice immigration visa support (one of the best)"," SW product development is a joke
- They want to learn by trying things out without involving outsiders who have been doing this since 10s of years
- They have an integration mindset, which is orthogonal to product development
- SW is all about prototypes. The strategy is all about showing prototypes to the world so that others would get inspired and buy more GPUs.","Reign in old time nvidia mgrs (very few are good). Hire professional managers and let them head software product teams; otherwise, nvidia will never be able to launch successful software products.",2.0,1.0,1.0,2.0,4.0,1.0
Wed Apr 26 2017 01:43:37 GMT-0700 (Pacific Daylight Time),,"Santa Clara, CA"," in Santa Clara, CA",Good,I worked at NVIDIA for more than 3 years,1,Free culture. Open to new ideas.New technologies,"No negatives yet. 

Location is a bit far",,5.0,4.0,4.0,4.0,3.0,3.0
Sat Apr 29 2017 20:25:56 GMT-0700 (Pacific Daylight Time),,"Santa Clara, CA",Current Employee ,Sr System SW Engr,I have been working at NVIDIA full-time for more than 3 years,,Open culture. Enough opportunities to grow,None that i know of,None,4.0,4.0,4.0,4.0,4.0,3.0
Thu Mar 30 2017 22:11:54 GMT-0700 (Pacific Daylight Time), Software Engineer,"Santa Clara, CA",Current Employee ,software engineer,I have been working at NVIDIA full-time for more than 3 years,1,stable and work life balance,old software tech in hardware company,,5.0,5.0,4.0,3.0,2.0,4.0
Thu Mar 30 2017 13:27:21 GMT-0700 (Pacific Daylight Time), Staffing,"Santa Clara, CA",Current Employee ,Staffing,I have been working at NVIDIA full-time for more than 3 years,,Our Mission: Bringing superhuman capabilities to some of the world's toughest problems. and we do just that. It is very exciting and fun time to be at NVIDIA.,Nothing to report at this time.,,5.0,4.0,5.0,5.0,5.0,4.0
Fri Mar 31 2017 16:01:51 GMT-0700 (Pacific Daylight Time), Software Engineer,"Santa Clarita, CA",Former Employee ,Software Engineer,I worked at NVIDIA full-time for more than a year,10,Monopoly in GPU and deep learning hardware,"Sweatshop, too many politics and unfairness inside.

For people who contribute, they got so much pressure and were demanded more.

Long working hours and poor benefits. Far below the bay area average",,2.0,2.0,2.0,2.0,2.0,2.0
Tue Mar 28 2017 21:08:24 GMT-0700 (Pacific Daylight Time), Program Manager,"Santa Clara, CA",Current Employee ,23-year old company with innovative mentality,I have been working at NVIDIA full-time for less than a year,,"Innovation, not bogged down by processes, willing to do what it takes to make it happen and do incremental improvements later.",People who have been there a long time are bit slow to change,,5.0,4.0,5.0,3.0,5.0,5.0
Fri Mar 17 2017 23:45:27 GMT-0700 (Pacific Daylight Time), Principal Software Engineer,"Los Angeles, CA",Current Employee ,Exciting and fasting moving place to work,I have been working at NVIDIA full-time for more than 5 years,2,"Working at the pulse of the latest in technology and artificial intelligence is great. NVIDIA is one of those rare companies that proclaims to have a startup mentality, and despite having 25 years of heritage, it actually does.","This company moves fast, you need to be agile to keep pace.",,5.0,5.0,5.0,5.0,5.0,5.0
Sun Mar 05 2017 11:04:32 GMT-0800 (Pacific Standard Time), Senior Research Scientist,"Austin, TX",Current Employee ,"Challenging, exciting work with fair compensation",I have been working at NVIDIA full-time for more than 3 years,2,"Forward looking agenda.
Transparency, 
Knowledgeable leadership, 
shallow management hierarchy. 
High expectations.
Reasonable compensation.
Not risk averse.
Easy to get voice heard. 
Strong foothold in multiple emerging key areas.","Still not perceived by the market at the level it should be. GPUs are primary drivers of compute power scaling, and hence are indispensable tools for technological growth, but a lot of the industry is still only coming to grips about the importance of NVIDIA .",,5.0,4.0,5.0,4.0,3.0,5.0
Tue Mar 07 2017 17:33:42 GMT-0800 (Pacific Standard Time), Software Engineer,"Santa Clara, CA",Current Employee ,best place to learn skills,I have been working at NVIDIA full-time for less than a year,,adjustable working schedule. you can learn many interesting skills here,muti-task in same time and a little busy,,5.0,5.0,4.0,5.0,5.0,5.0
Wed Feb 22 2017 11:34:37 GMT-0800 (Pacific Standard Time), Senior Network Engineer,"Santa Clara, CA",Current Employee ,At Nvidia the Future is Now!,I have been working at NVIDIA full-time for less than a year,2,"Working at Nvidia is fun! The working environment is great, colleagues are very helpful and extremely smart. Everything happens here at Speed of Light. Lot of amazing benefits that are best in the industry. The company believes in transparency and we can see this value in its culture. At Nvidia winning is important but its more important that if we fail then we fail together and not alone. This is how we roll and we take risks knowing that we will never fail alone! I am proud and fortunate enough to be a part, of this great Company!",Cafeteria food can be better and subsidized. Internal gear store can use a boost and increase in the number of things they sell.,Excellent Job! Set clear goals and lets continue to move together in the direction of these goals at Speed of Light.,5.0,4.0,5.0,5.0,5.0,5.0
Wed Feb 15 2017 05:34:26 GMT-0800 (Pacific Standard Time), Senior Software Engineer,"Santa Clara, CA",Current Employee ,Graphics and Videogames,I have been working at NVIDIA full-time for less than a year,2,"You get to play videogames on the best systems currently in existence, and get paid to do it. The place is one big team, and it is great if you are looking for a challenge. Compensation is better than the average for the skilled worker.","Insanely steep learning curve. Great if you have the capacity to learn under pressure, but not if you get stressed about your schedules.",,5.0,2.0,5.0,4.0,5.0,5.0
Wed Mar 08 2017 11:42:21 GMT-0800 (Pacific Standard Time),,"Calif City, CA","Senior ASIC Design Engineer in Calif City, CA",Good,I have been working at NVIDIA,,Good place to work and people are friendly. You will get to work with cutting edge technology. People are receptive of new ideas,Long work hours. People should learn to socialize a little more and should not stick to their cubicles. Need to give bonus and RSUs to New college graduates,Nothing in particular,3.0,3.0,3.0,3.0,3.0,3.0
Mon Feb 20 2017 13:24:13 GMT-0800 (Pacific Standard Time), Hardware Engineer,"Santa Clara, CA",Current Employee ,Great Place to Work,I have been working at NVIDIA full-time for more than a year,,Rapidly growing company; not a bloated work force means everything you do counts.,More meaningful and exciting work per employee; can affect work/life balance.,,5.0,3.0,5.0,5.0,4.0,5.0
Wed Feb 15 2017 07:39:53 GMT-0800 (Pacific Standard Time), Sourcing Recruiter,"Santa Clara, CA",Current Employee ,Great Place to Work!,I have been working at NVIDIA full-time for more than a year,," Management open to new ideas
- Open communications
- Encouraged to drive process
- Co Workers excited to come to work
- Positive environment
- Flexibility to achieve success with your own methods, not a cut and paste environment", need more headcount in certain areas to achieve top results faster, hire larger recruiting team,5.0,5.0,5.0,4.0,4.0,4.0
Mon Jan 23 2017 09:40:56 GMT-0800 (Pacific Standard Time), Senior Software Engineer,"Austin, TX",Current Employee ,Very good Company to Work,I have been working at NVIDIA full-time for less than a year,5,"I joined NVIDIA four months ago.
My engineering manager is very friendly and supportive.
Coworkers are very friendly and productive.
The job description is very clear so that every body knows which area you are working on.
You feel like your working to invent a cutting edge technology.
I am very happy to work for Nvidia. In addition, they pay very well.",I do not see any cons yet. Maybe because I am new.,,5.0,5.0,5.0,5.0,5.0,5.0
Thu Feb 02 2017 08:22:05 GMT-0800 (Pacific Standard Time), Senior Software Developer,"Durham, NC",Current Employee ,Excellent place to work,I have been working at NVIDIA full-time for less than a year,2,"I work with some of the smartest people I've ever met on cutting edge tech, what's not to like? 
Big community around AI especially with lots of resources for learning and improving yourself.
The benefits are just amazing and very thought out for busy people with families.
Feel like I'm making a positive difference in the company and in society.","The org is a bit fragmented and complex and it's hard to get the gist of the structure of it all. 
Not obvious how to move up the ladder.
A bit set in their ways in regards to tech stack.",Help more with long term career coaching so your employees envision and plan to work here long term.,5.0,5.0,5.0,2.0,5.0,5.0
