date,employee_title,location,employee_status,review_title,years_at_company,helpful,pros,cons,advice_to_mgmt,rating_overall,rating_balance,rating_culture,rating_career,rating_comp,rating_mgmt
Mon Oct 28 2019 00:18:48 GMT-0700 (Pacific Daylight Time),,"Santa Clara, CA",Current Employee ,great place to work,I have been working at NVIDIA full-time for more than a year,,"great place to work, lots to learn and freedom to explore",salary hikes might be lower than expected,keep up the good work,5.0,4.0,5.0,5.0,2.0,4.0
Sun Oct 27 2019 09:57:39 GMT-0700 (Pacific Daylight Time),,"Santa Clara, CA",Current Employee ,Senior QA dev,I have been working at NVIDIA full-time for more than a year,,"Great work life balance
Cutting edge technology
CEO is exceptional","Compensation could be better
Review process could be improved",,5.0,5.0,5.0,5.0,3.0,5.0
Tue Oct 22 2019 13:07:09 GMT-0700 (Pacific Daylight Time), Senior Systems Software Engineer,"Santa Clara, CA",Current Employee ,Amazing Innovation with exemplary leadership,I have been working at NVIDIA full-time for more than 3 years,,Ownership with failures. Leadership navigates teams to right projects based on their skillset. Pivots quite fast.,Chaos with a few groups and sometimes does not help with the larger vision.,,5.0,5.0,4.0,4.0,4.0,5.0
Thu Oct 10 2019 00:44:03 GMT-0700 (Pacific Daylight Time), Senior Software Developer,"Santa Clara, CA",Current Employee ,Great innovative company with lots of possibilities,I have been working at NVIDIA full-time for more than 8 years,,"Flexibility and focus on results rather than formal procedures, so it is convenient to work here.
Great appreciation for innovation, research and improvements.
Steady growth in terms of career, and a lot of possibilities for personal development - like internal lectures/conferences, partner programs with universities, web learning portals, domain experts, etc.
Bleeding edge technology and experts in multiple fields, ties to the scientific R&D - and you can take part in any of those fields and acquire knowledge from experts.
Competitive salaries.
Management is mostly built of people with serious practical background, so they have a lot of understanding what is going on, and a vision that is both very practical, AND innovative.
Feeling that you build and shape future.","Mentioned flexibility doesn't work well for all of the people - some people feel comfortable with more strict, managed environment, strictly formulated tasks and timeframes, and don't appreciate too much of the individual freedom.
Resources of the company are more limited to those of a bigger companies which sometimes may be perceived as a good thing sometimes (work smarter, not harder), but otherwise it limits the potential possibilities.","IT infrastructure needs to be even better (it is being improved, but at rates that are slower that is desirable).",5.0,5.0,5.0,5.0,5.0,5.0
Wed Oct 23 2019 10:50:09 GMT-0700 (Pacific Daylight Time), Software Engineer,"Santa Clara, CA",Current Employee ,"Okay for a while, not a place to stay",I have been working at NVIDIA full-time for more than 8 years,," Salary and Bonuses are less than say, Google or Amazon, but still quite good. ESPP in particular is great generally, and has been amazing over the past 10-ish years.
- Fellow engineers tend to be dedicated and skilled.
- Being in a fabless semiconductor company provides unique challenges compared to say, transmitting advertisements 1% faster."," A switch to ""Agile"" development was done by people who have no idea what Agile is
- Depending on your team, if you don't put 6 hours in per day in JIRA, you will get a nag email. Helping other teams? No way! Going to meetings? Well, not too many...
- Corners are cut frequently. You will never feel proud of your work, always surprised it shipped.
- Does some task require special expertise? Well here is a 1 hour meeting about it a week after the task needs to be done. Maybe just read the slides, no time to actually attend that meeting. Want to read a book to understand the topic better? No way, there is no JIRA task for that.
- Employees complained about lack of Learning and Development resources so, they paid for Coursera. Not enough for all employees, so you may have to wait. No support for learning on the job, so I guess the idea is that you'll log in on a weekend to watch videos that are often freely available.
- Very few retros/post-mortems, multiple chips will go by without your team stopping to explore why testplans are always being trimmed to be actually completed, and even then very few changes will be implemented.
-Maybe you will work 12 hours a day , 7 days a week for months. Well enjoy your expensed lunches and dinners on the weekend, that's all it's going to get you. Counts for nothing towards management, Just say No when they ask.",,2.0,2.0,3.0,3.0,4.0,3.0
Mon Oct 07 2019 14:06:46 GMT-0700 (Pacific Daylight Time), Senior ASIC Design Engineer,"Austin, TX",Current Employee ,Great company,I have been working at NVIDIA full-time for more than 3 years,,"You can focus on your job, not dealing with the company. The engineering managers are also engineers. People work hard and are smart. Compensation is excellent. Nvidia is involved in a lot of very exciting technologies. Benefits are also good, and work hour expectations in my group are reasonable.","Some higher-ups are very opinionated, so significant decisions are often dictated by them. Certain significant people are very demanding, which can create some stress at times. It's a slightly aggressive culture, in terms of pushing for difficult challenges.","Show more appreciation. But honestly management is doing a good job. Although sometimes I wish certain people were a little more laid back, I do like that everyone works hard and gets a lot done.",5.0,5.0,4.0,4.0,5.0,5.0
Thu Oct 03 2019 16:32:20 GMT-0700 (Pacific Daylight Time), Senior Systems Engineer,"Santa Clara, CA",Current Employee ,"good culture, smart people",I have been working at NVIDIA full-time for more than 10 years,,"The company culture is designed for engineers to be able to do their best work. Honesty is rewarded, covering up is not. That's unusual in the tech world.
Rank and seniority don't mean a lot. If your idea is good, it doesn't matter who you are or how long you've been here.
Lots of people here who literally wrote the book on their technological specialty.
Zero tolerance for ethnic/racial/gender/age discrimination. That's not from HR, it's everywhere. Do or say something that appeals to stereotype or prejudice and people think you're an idiot. Maybe that's how things are in 2019 techworld, but it sure is refreshing.
The commitment to reducing our environmental footprint is genuine. The stuff I've fought for at other companies along those lines is already happening here. Company strongly encourages commuting by bike, public transit, carpool or work from home.","IT is under-resourced, and gets snookered by consultants and the occasional snake oil salesman.","Spend more on IT, and outsource less. IT needs to take user feedback more seriously.",5.0,4.0,5.0,5.0,5.0,4.0
Wed Oct 02 2019 12:10:55 GMT-0700 (Pacific Daylight Time), DevTech Engineer,"Durham, NC",Current Employee ,Great company that cares about employees and keeps up with market change,I have been working at NVIDIA full-time,,"Competitive pay
AMAZING benefits
Great senior leadership; Jen-Hsun has kept the company up-to-date and adapted to a very fluid market
Company's first priority in investment is people, not corporate fluff
Remote work (some positions)
Big company but startup culture
Ability to move within company",Some work can be repetitive at times (not always),,5.0,5.0,5.0,5.0,5.0,5.0
Tue Sep 24 2019 11:17:24 GMT-0700 (Pacific Daylight Time), Verification Design Engineer,"Austin, TX",Current Employee ,Inspiring leadership whom employees and shareholders actually believe in!,I have been working at NVIDIA full-time for more than a year,2,"Very competitive salary and benefits for this industry.
Very high level of technical and corporate transparency across teams/sites (this is in striking contrast to many other so-called leading companies in this industry!)
Everyone believes in and works towards the company's goals and vision.
High employee morale and corporate pride.
Shared sense of success (and failures too) - not a ""me"" culture.
Employees feel valued.
Minimal politics that would block technical people from achieving their goals.
Agile decision making and course correction to stay on track with product roadmaps.
Company does not live in the past or rest too much on past success.
Fair amount of work/life balance (as long as you take responsibility).","Not suitable for people who aren't self-starters - often frustrating when onboarding to a new team to get very little help from peers which results in wasted trial/error.
A lot of tribal knowledge and sparse/outdated internal documentation/websites make it difficult and inefficient to find information.
Matrixed org structure leads to firstline managers with unmanageable amount of direct reports resulting in very low opportunity for focused one-on-one time, coaching, and development.
Too much focus on projects and staffing at Headquarters - this leads to limited growth/movement opportunities for people outside of California.
Rapid growth is stressing the company's resources and historically closeknit culture.","Thank you for being open, transparent, and most of all trusting your employees with the technical knowledge that you share globally within the company.

NVIDIA has grown up into a 14k+ employee global enterprise. It's time to realize that the old matrix/flat org structure isn't scalable anymore and doesn't support employee development. This is in large part due to managers who can no longer deliver results AND develop their people if their staff/scope is too large. 

Top level leadership should change the message to project/team managers that good talent may not necessarily exist (or want to live) in Santa Clara and they MUST be open to supporting cross-site teams. Otherwise, non-California employees will miss out on growth opportunities, get frustrated, and will be quickly recruited away by your competitors.",5.0,4.0,5.0,3.0,5.0,4.0
Fri Sep 27 2019 10:27:21 GMT-0700 (Pacific Daylight Time), Senior Software Engineer,"Santa Clara, CA",Current Employee ,Great place to work,I have been working at NVIDIA full-time for more than a year,,"Who doesn't like video games, robots, self driving cars, AI, and high performance computing all in one company? There are projects in almost every area of hardware and software design. Great culture around designing the highest performance products based on what can be done verses what is ""good enough"". The benefits are good, Jensen understands and cares about employees.","Deadlines can be tight, a lot is asked of employees to deliver at times, so can be stressful like most companies.","Mostly, keep doing what you are doing. Tech companies depend on good engineers having interesting work, the tools to do a good job, and keeping overheads of meetings and process low.",5.0,4.0,5.0,5.0,5.0,5.0
Thu Sep 26 2019 10:00:09 GMT-0700 (Pacific Daylight Time), Verification Engineer,"Boston, MA",Current Employee ,Good challenging environment to work,I have been working at NVIDIA full-time for more than 3 years,,"Great Pay and excellent benefits, Challenging work, Recognition",Tight deadlines which can cause work load to increase at times.,,5.0,4.0,5.0,5.0,5.0,5.0
Tue Sep 24 2019 22:52:48 GMT-0700 (Pacific Daylight Time), Senior Software Architect,"Santa Clara, CA",Current Employee ,Great culture of innovation,I have been working at NVIDIA full-time for more than 5 years,,"Cool new tech, amazing people, phenomenal leadership, friendly and open environment, flexible schedule, reasonable pay, good benefits","Work/life balance could be better, open space environment sucks, cafeteria is underwhelming","Open space workplace is the dumbest idea of all times. It might work for call centers, but it's a disaster for an engineering organization",5.0,4.0,5.0,5.0,5.0,5.0
Wed Sep 25 2019 11:03:10 GMT-0700 (Pacific Daylight Time), Recruiting Operations Specialist,"Santa Clara, CA",Current Employee ,Happy to be at NVIDIA,I have been working at NVIDIA full-time for more than a year,,"The culture, the people and the growth are the top pros! These are things that are irreplaceable.",The cafe sometimes doesn't have the best food choices.,,5.0,5.0,5.0,5.0,4.0,5.0
Tue Sep 24 2019 10:29:44 GMT-0700 (Pacific Daylight Time), Senior Systems Software Engineer,"Santa Clara, CA",Current Employee ,Great place to work,I have been working at NVIDIA full-time for more than a year,,"Amazing culture, great work-life-balance and a strong drive to succeed in every area makes NVIDIA one of the best places I've ever worked. Their commitment to moving at the speed of light in every thing they do keeps such a large company nimble and able to respond quickly to shifts in the marketplace.",Moving at the speed of light leaves less room for process and more room for chaos. If you can handle a fluid org chart and requirements that change on sometimes a weekly basis for the bleeding edge projects then you've found the right home. If on the other hand you want stability and things that move with a little more deliberation then the hardware side of the house would be more your speed.,It's a little too easy for managers to carve out their own fiefdom and then defend it. The fluid org chart makes it seem that this wouldn't be possible but the social pressure - especially on high profile projects - keeps some walls up that really should be broken down.,5.0,5.0,4.0,4.0,5.0,4.0
Tue Sep 24 2019 10:47:07 GMT-0700 (Pacific Daylight Time), Technical Marketing Engineer,"Santa Clara, CA",Current Employee ,Best job I've had,I have been working at NVIDIA full-time for more than a year,,"I've been at NVIDIA for about a year and a half. Great mix of employees (age, background, ethnicity , and so forth). Lots of common-sense perks. Relatively flat organization with a fair amount of CEO oversight/visibility. 

The Santa Clara corporate headquarters is a beautiful space. Look forward to coming into work. Great to have cubicles and not an ""open office"" environment. 

Flexible as far as work@home goes.","None worth mentioning. And, this is based on over 20 years in the tech industry.",,5.0,5.0,5.0,5.0,5.0,5.0
Tue Sep 24 2019 20:56:22 GMT-0700 (Pacific Daylight Time), Senior Reliability Test Engineer,"Santa Clara, CA",Current Employee ,One of the best high tech company to work for,I have been working at NVIDIA full-time for more than a year,,"Work flexibility, good compensation and benefits, a lot of new technology to learn and work on.","None so far, still new to the company",,5.0,5.0,5.0,5.0,5.0,5.0
Mon Sep 23 2019 05:00:12 GMT-0700 (Pacific Daylight Time), Distinguished Engineer,"Westford, MA",Current Employee ,Talented and collaborative organization,I have been working at NVIDIA full-time for more than 10 years,,"The litmus test for good engineers is the willingness to listen and, when the conclusion is different than the plan, to change the plan. NVIDIA is full of engineers who are thoughtful and have the capacity to accept change.","Number one goal is always schedule. In pursuit of schedule, decision makers change the scope of work in order to meet schedule. Sometimes this means useful and important features are pushed to a later generation or architecture. After investing months or years on a feature, it is disappointing.",Keep making good decisions. Recognize differences as valuable and part of our strength.,5.0,4.0,5.0,5.0,5.0,5.0
Mon Sep 23 2019 05:09:31 GMT-0700 (Pacific Daylight Time), Senior Software Engineer,"Durham, NC",Current Employee ,Fantastic Place to Work,I have been working at NVIDIA full-time for more than a year,,"* Intellectual honesty is not just encouraged, it's required
* Relatively flat organization, easy to talk to whoever you need
* NVIDIA is still innovating like crazy, I love it","* Lack of ""organizational charts"" (on purpose) makes it difficult to ""find the right person"" on your own",,5.0,5.0,5.0,5.0,4.0,5.0
Mon Sep 23 2019 05:57:55 GMT-0700 (Pacific Daylight Time), VGPU Specialist,"Detroit, MI",Current Employee ,Excellent place to work,I have been working at NVIDIA full-time for less than a year,,"NVIDIA supports me completing my MBA, offers flexible work hours, and has an excellent management team","Honestly, i have only been here 6 months and so far there have been no issues","Keep doing everything you are doing, absolutely my favorite place to work!",5.0,5.0,5.0,5.0,5.0,5.0
Mon Sep 23 2019 08:07:02 GMT-0700 (Pacific Daylight Time), Platform Engineer,"Santa Clara, CA",Current Employee ,Best Company to Work for,I have been working at NVIDIA full-time for less than a year,,"Cutting edge technology, great work culture, great work environment, office shuttle",Getting to work from some area takes more time despite the distances.,,5.0,4.0,5.0,4.0,5.0,5.0
Mon Sep 23 2019 09:37:17 GMT-0700 (Pacific Daylight Time), Marketing Manager,"Santa Clara, CA",Current Employee ,Could work here forever,I have been working at NVIDIA full-time for more than a year,,"Exciting products and industries
-Culture encourages personal growth and lateral movements
-Awesome new headquarters",They don't have a San Francisco office,Please continue to work hard to preserve our awesome culture.,5.0,5.0,5.0,5.0,5.0,5.0
Mon Sep 23 2019 10:25:10 GMT-0700 (Pacific Daylight Time), Software Engineer,"Santa Clara, CA",Current Employee ,NVIDIA - Best Company to Work For,I have been working at NVIDIA full-time for more than a year,,"I have joined NVIDIA as Software Engineer. Though my association with NVIDIA is just over an year, I have lots of Pros to discuss here.
1. Best Work Culture
2. PTO's and WFH is among the Best in the Tech industry.
3. Maternal and paternal leaves are awesome.
4. Getting to work on leading cutting edge technologies and your peers and mentors are completely supportive of your endeavor.
5. ESPP rocks!
6. Good Pay and other benefits like Medical, dental etc...
7. RSU grant and refreshers are OK.....",1. RSU refreshers could be slightly higher.,"Don't really need to give any advice as our Management is right on track and I would only hope to see the same in coming lot many years!

Great Work NVIDIA and I really take pride to be called a NVIDIAN !",5.0,5.0,5.0,5.0,4.0,5.0
Mon Sep 23 2019 10:32:43 GMT-0700 (Pacific Daylight Time), Senior Product Manager,"Santa Clara, CA",Current Employee ,You can see the impact of your work,I have been working at NVIDIA full-time for more than a year,,"Hit the ground running and leverage your skills right away.
Your team and teams around you provide guidance on what to do and how to contribute. 
See the impact of your work directly on products, services and other areas unrelated to your direct job responsibilities. 
Everyone has a voice at the table. 
In a way, each team works like a start-up. 
Flexibility in work schedules and places and almost all collaboration tools are supported.",The team start-up work environment might not be the most appealing for some.,"The CEO does a great job at updating the company regularly through company meetings, but in between, management could have pass-down meetings more frequently.",5.0,5.0,5.0,5.0,5.0,5.0
Mon Sep 23 2019 11:58:48 GMT-0700 (Pacific Daylight Time), Principal Engineer,"Santa Clara, CA",Current Employee ,Great place developing breadth of knowledge,I have been working at NVIDIA full-time for more than 10 years,,Allows more responsibility and breadth of skills than other companies. More impact possible for new engineers. Top notch talent all around. World leader in graphics and Deep Learning.,"In a competitive space, lots of moving priorities and challenges.",,5.0,3.0,4.0,4.0,5.0,5.0
Mon Sep 23 2019 13:07:02 GMT-0700 (Pacific Daylight Time), CPM,"Santa Clara, CA",Current Employee ,Good company to work with,I have been working at NVIDIA full-time for more than 10 years,,"Nice people, flexible time, cutting edge technology, smart CEO","food is not good, parking is terrible",,5.0,5.0,5.0,5.0,5.0,5.0
Mon Sep 23 2019 13:10:55 GMT-0700 (Pacific Daylight Time), Senior Software Engineer,"Santa Clara, CA",Current Employee ,Excellent company to work at,I have been working at NVIDIA full-time for more than 10 years,,"More interesting work to do than can be done in ten lifetimes. Chance to constantly work at the cutting edge with people who favor results and not drama. Your work will be used by many many people, and you will get to advance the state of the art for entire industries. Company is very flexible, and willing to accommodate people who work hard and perform well.",Hard to stay on top of everything all the time.,"Not a lot really. I think NVIDIA management has done a phenomenal job, and they are constantly adjusting to respond when there are issues.",5.0,4.0,4.0,4.0,5.0,5.0
Mon Sep 23 2019 15:09:26 GMT-0700 (Pacific Daylight Time), Senior Architect,"Austin, TX",Current Employee ,Reminds me of a young IBM,I have been working at NVIDIA full-time for more than 5 years,,"We have thousands of amazing minds working on a variety of hardware, software, and architectural problems. Of those minds, they can be on their first week of employment or have been here for 25 years and still have their idea appreciated. We are carefully planning and trying to move into new markets to leverage all of those minds.","It's a delicate balance to measure risk and reward on every suggestion. As any company grows, it is important to not get too complacent or morale, profits, and success will all drop.",Never be afraid of risk. Let your continually growing wisdom as senior engineers measure and evaluate risk while also letting the technology of a technology company flourish.,5.0,5.0,5.0,5.0,5.0,4.0
Mon Sep 23 2019 17:12:09 GMT-0700 (Pacific Daylight Time), Senior Technical Program Manager,"Santa Clara, CA",Current Employee ,Best tech company to work for today !,I have been working at NVIDIA full-time for more than a year,,"Get to work on next generation cutting edge technologies. Great people, Great compensation and infinite stock growth potential.",None that I could think of.,,5.0,5.0,5.0,5.0,5.0,5.0
Sun Sep 22 2019 17:15:36 GMT-0700 (Pacific Daylight Time), Principal Engineer,"Santa Clara, CA",Current Employee ,Pursue your passion,I have been working at NVIDIA full-time for more than 8 years,,"You would do what is best for you and best for the company
Pursue your passion at full speed without spending much time in regular chores around the job.
Work with some of world class engineers in an open and cooperative environment.",You will be lost in the depth of innovation and the details of what it takes to really deliver something.,,5.0,4.0,5.0,5.0,5.0,5.0
Sat Sep 21 2019 18:30:49 GMT-0700 (Pacific Daylight Time), Senior Software Engineer,"Santa Clara, CA",Current Employee ,Great company to work for with top-notch benefits,I have been working at NVIDIA full-time for more than a year,,You have the opportunity to work on best in class products that are solving real world problems. You're working with other talented engineers that keep the work efficient and agile. Every engineer gets a change to influence change in the products or software shipped to customers. Despite the size of the company many aspects are similar to working for a startup.,"Long hours are not unusual, but employees can typically set their own work/life balance expectations.",,5.0,3.0,5.0,4.0,5.0,5.0
Fri Sep 20 2019 08:06:56 GMT-0700 (Pacific Daylight Time), Solutions Architect,"Santa Clara, CA",Current Employee ,Amazing opportunities to learn,I have been working at NVIDIA full-time for less than a year,,"Within solution architecture, I have been able to explore multiple fields within ai and learn a lot. Coworkers are brilliant and there is always an expert to ask questions to.","With solution architecture there isn't a clear way as to what you can do next in your career. Nvidia will let you move between organizations, but there isn't a super established path as to how you grow career wise, some go into business development and some into engineering and product.",,5.0,4.0,5.0,5.0,5.0,5.0
Fri Sep 20 2019 11:47:16 GMT-0700 (Pacific Daylight Time), Senior Software Engineer,"Santa Clara, CA",Current Employee ,Autonomous Car Team,I have been working at NVIDIA full-time for less than a year,," Work-life balance
- ESPP Options
- Onsite bar
- Learning opportunities",I wish there was an onsite gym,,5.0,5.0,5.0,5.0,,
Fri Sep 20 2019 11:53:26 GMT-0700 (Pacific Daylight Time), Senior Architect,"Santa Clara, CA",Current Employee ,Great place for your life's work,I have been working at NVIDIA full-time for more than 5 years,,"+Very little politics
+Very good work/life balance
+Great for those with families (due to work/life balance, culture, and benefits)
+Competitive salary
+Great benefits (especially commuter shuttles with wifi, ESPP, and 401K match)
+Data driven
+Respectful and diverse co workers (race, gender, political, age, etc)
+Work is always challenging and interesting, so never bored
+Company cares about environment, human rights, and helping out community","Weekly night meetings with other half of team in India
-More convenient fitness options onsite would be nice
-More shuttle commute times would be nice",,5.0,5.0,5.0,5.0,4.0,5.0
